{"items": [{"artLink": "/bbs/Stock/M.1559897030.A.169.html", "artAuthor": "Disney", "artTitle": "[新聞] 中國重整鋼鐵業 寶武將與馬鋼合併 產量", "artDate": "1559897030", "getContent": "N", "artBody": "作者Disney (迪士尼)看板Stock標題[新聞] 中國重整鋼鐵業 寶武將與馬鋼合併 產量時間Fri Jun  7 16:43:47 2019\n1.原文連結：https://ec.ltn.com.tw/article/breakingnews/2810715\n\n2.原文內容：中國重整鋼鐵業 寶武將與馬鋼合併 產量直逼世界第1\n\n2019-06-03 16:27  自由時報\n\n〔財經頻道／綜合報導〕中國第1、世界第2大鋼鐵廠「中國寶武鋼鐵集團」與中國第7、\n世界第16大鋼鐵廠「馬鋼集團」已確定將正式合併，寶武將控有馬鋼51%股份，使中國鋼\n鐵業者距離產鋼量世界第1的盧森堡「安賽樂米塔爾」（ArcelorMittal）又更近了一步。\n\n中媒《華爾街見聞》報導，馬鋼於2日晚間發出公告，表示寶武取得馬鋼51%股權；而在此\n之前馬鋼股權100%由安徽省國有資產監督管理委員會（國資委）所持有，由於寶武是國務\n院國資委控有的國營事業，代表馬鋼集團的實際控制人從安徽省政府轉移到了中央的國務\n院。\n\n該公告稱，此合併案將壯大安徽省國有經濟、促進鋼鐵產業發展、推動安徽省產業轉型，\n也能成為推動寶武成為「全球鋼鐵業的引領者」的「偉大願景」，打造鋼鐵業世界級的技\n術創新、產業投資及資本營運等。\n\n報導指出，2018年寶武跟馬鋼粗鋼產量總和為8707.13萬噸，代表合併後與安賽樂米塔爾\n年粗鋼產量的9250萬噸相去不遠，而寶武更推動2年後產能將達到年產1億噸。\n\n此舉不但有助於解決中國嚴重的「殭屍鋼鐵廠」問題，也可能與美中貿易戰有關。所謂殭\n屍鋼鐵廠，就是可能因非法且品質低劣而被政府要求，或是其他因素而停產但尚未關閉的\n鋼鐵廠。\n\n日本《日經新聞》報導稱，在全球前景不確定性增加的背景下，中國政府旨在透過重組、\n整頓鋼鐵業已解決產能過剩、保持競爭力、經營狀況及營利能力的策略。\n\n3.心得/評論：中鋼如果合併台鋼+越鋼成功的話，抵抗中國鋼鐵廠合併，剛剛好！\n             中鋼股價因此受惠！\n\n--\n                 ██◣  ███  █▄█  █◣█  █▄▄ █  █\n█  █    █    ▄█▄  ███  ███  ▂█▂\n██◤  ███  █▄█  █◥█  █▄▄    █\n\n--\n※ 發信站: 批踢踢實業坊(ptt.cc), 來自: 112.104.96.18 (臺灣)\n※ 文章網址: https://www.ptt.cc/bbs/Stock/M.1559897030.A.169.html\n推 kline       : 什麼都要搞最大，聽起來一副很威，但最大不代表最強 06/07 16:46\n→ bamama56    : 簡稱寶馬好了 06/07 16:47\n→ hugoyo      : 粗鋼量有什麼好說嘴的 06/07 16:50\n推 k1k1832002  : 中國是有那麼欠鋼嗎 06/07 16:52\n→ borriss     : 鋼鋼好 06/07 16:58\n推 boy830527   : 讓我想到京東方整天吹產能第一 結果沒補貼早就倒了 06/07 17:18\n推 saintsmw    : 原來大家都覺得合併後中國鋼鋼好 06/07 17:22\n推 henryyeh5566: 白菜價鋼卷又要來囉 06/07 17:24\n推 wingstar    : 兩家生產品質都很差的公司合併是有甚麼好高興 06/07 17:26\n推 chanceperson: 不是產能過剩？ 拼產量要幹嘛？ 06/07 17:35\n推 eric878787  : 大躍進 06/07 17:41\n推 AkiMinoriko : 再擴產就是全世界鋼廠一起賠錢啊 06/07 18:09\n推 southpeace  : 不要小看白菜好嗎 06/07 18:20\n推 DAEVA       : 因該是要拼自產量35%上到60%   壓低進口 06/07 18:52\n→ ericjaing   : 合併好，原本兩家賠錢，合併後成一家賠，賺了50% 06/07 19:09\n推 chiefoflaw  : 中鋼準備GG 06/07 19:40\n推 saintsmw    : 解決產能過剩，就是要裁員，有人要下崗~~ 06/07 19:50\n", "artBodyLink": ["https://ec.ltn.com.tw/article/breakingnews/2810715", "https://www.ptt.cc/bbs/Stock/M.1559897030.A.169.html"], "artCmt": [["推 ", "kline       ", ": 什麼都要搞最大，聽起來一副很威，但最大不代表最強"], ["→ ", "bamama56    ", ": 簡稱寶馬好了"], ["→ ", "hugoyo      ", ": 粗鋼量有什麼好說嘴的"], ["推 ", "k1k1832002  ", ": 中國是有那麼欠鋼嗎"], ["→ ", "borriss     ", ": 鋼鋼好"], ["推 ", "boy830527   ", ": 讓我想到京東方整天吹產能第一 結果沒補貼早就倒了"], ["推 ", "saintsmw    ", ": 原來大家都覺得合併後中國鋼鋼好"], ["推 ", "henryyeh5566", ": 白菜價鋼卷又要來囉"], ["推 ", "wingstar    ", ": 兩家生產品質都很差的公司合併是有甚麼好高興"], ["推 ", "chanceperson", ": 不是產能過剩？ 拼產量要幹嘛？"], ["推 ", "eric878787  ", ": 大躍進"], ["推 ", "AkiMinoriko ", ": 再擴產就是全世界鋼廠一起賠錢啊"], ["推 ", "southpeace  ", ": 不要小看白菜好嗎"], ["推 ", "DAEVA       ", ": 因該是要拼自產量35%上到60%   壓低進口"], ["→ ", "ericjaing   ", ": 合併好，原本兩家賠錢，合併後成一家賠，賺了50%"], ["推 ", "chiefoflaw  ", ": 中鋼準備GG"], ["推 ", "saintsmw    ", ": 解決產能過剩，就是要裁員，有人要下崗~~"]]}, {"artLink": "/bbs/Stock/M.1559897335.A.29E.html", "artAuthor": "gongling", "artTitle": "Re: [新聞] 美推動取消中國在WTO的發展中國家地", "artDate": "1559897335", "getContent": "N", "artBody": "作者gongling (nikt)看板Stock標題Re: [新聞] 美推動取消中國在WTO的發展中國家地位時間Fri Jun  7 16:48:53 2019\n中國做的印度也很多在做，發射衛星太空爭霸，拓展非洲等等\n只是國力差一點而已\n而且印度經常說自己是超級大國\n很快成為發達國家\n\n原po說中國刻意保持人均GDP低也是超扯\n中國一直想人均gdp高的喔\n只是人均高就需要對外拓展和中國製造2025啊\n就要發展內陸啊\n中國現在剝削沿海和富人\n在內陸鄉下地區大興土木\n花巨資給內陸窮人\n一帶一路拓展內陸交通\n\n中國人均要高\n總國民所得就必須要超過美國啊\n但是美國又不想讓中國超過美國\n川普說絕對不能再他任內讓中國GDP超過美國\n那就是矛盾啊\n中國GDP不超過美國\n人均就離發達國家人均很遠\n怎麼讓中國被當做發達國家呢？\n\n--\n※ 發信站: 批踢踢實業坊(ptt.cc), 來自: 18.138.79.216 (美國)\n※ 文章網址: https://www.ptt.cc/bbs/Stock/M.1559897335.A.29E.html\n→ Atima       : 印度還不管藥物版權咧 超機歪的06/07 16:49\n噓 AGODC       : 聽說美國人跟中國人都一樣每天要吃飯睡覺耶06/07 16:55\n推 sunnyhung   : 印度人有種姓制度，強大會有限制，不會威脅到美國!06/07 16:59\n推 good5755    : 印度有開放FB YT GG 中國有開放?06/07 17:04\n噓 johnny9667  : 印度窮成這樣，人均不到兩千，連非洲一些國家都比印06/07 17:05\n→ johnny9667  : 度有錢了。06/07 17:05\n原po文章的理由不是人均，而是太空爭霸，對外拓展，這些印度都在做\n\n噓 iamten      : 美國對印度也不爽好嗎06/07 17:08\n推 watashiD    : 畢竟中國人口這麼多，你有聽過經理比基層多的公司06/07 17:17\n→ watashiD    : 嗎06/07 17:17\n推 boy830527   : 中國一堆企業經理都是title 客戶經理一堆 總監一堆06/07 17:20\n→ boy830527   : 而且中國公司很多一天工作12-14小時起跳 假日也在工06/07 17:21\n→ boy830527   : 作 年薪15-20萬rmb 做業務的不分男女10個9.5個要陪06/07 17:21\n→ boy830527   : 睡 剩下0.5的是長太醜06/07 17:21\n噓 pornsp      : 這篇文真的搞不清楚狀況，其實中國已開發或開發中國06/07 17:21\n→ pornsp      : 家對台灣其實沒差，差別是牠們的態度，印度會去欺壓06/07 17:21\n→ pornsp      : 其他國家？？會去搞一帶一路？？重點在那邊，請原po06/07 17:21\n→ tym44       : 這麼厲害的國當然是發達國家06/07 17:21\n→ pornsp      : 回去再唸點書好嗎？06/07 17:21\n印度其實有欺壓鄰國啊，譬如尼泊爾\n也有吞併，譬如Sikkim\n印度也有他們的一帶一路，Project Mausam\n\n推 nk10803     : 很多沿海一帶的台資都慢慢被趕進內陸去zzzz06/07 17:32\n※ 編輯: gongling (18.138.79.216 美國), 06/07/2019 17:38:39\n推 killerking05: 印度對巴基斯坦很好?那是印度現在不夠強而已 06/07 17:36\n噓 hb0922      : 呵呵 捧印度就扯蛋了 無腦綠 06/07 17:40\n→ dragonjj    : 已發展國家並沒有明確定義喔 06/07 17:42\n推 chriter     : Project Mausam不就是為了反制一帶一路而來的 06/07 17:42\n噓 johnny9667  : 無腦綠 06/07 17:47\n推 KarlTowns   : 印度野心比中國大多了，周圍都想併吞，尼泊爾、巴基 06/07 18:29\n推 kusomanfcu  : 人一綠腦就 06/07 18:39\n噓 miketk      : 管人家怎樣。有人弄台灣的敵人就是爽啦。 囉哩八唆 06/07 18:39\n→ miketk      : 一堆 06/07 18:39\n→ miketk      : 管他印度美國怎樣。 有人弄中共就是爽。 06/07 18:40\n→ sohopro     : 是強國就不要再逃避責任 06/07 19:13\n", "artBodyLink": ["https://www.ptt.cc/bbs/Stock/M.1559897335.A.29E.html"], "artCmt": [["→ ", "Atima       ", ": 印度還不管藥物版權咧 超機歪的"], ["噓 ", "AGODC       ", ": 聽說美國人跟中國人都一樣每天要吃飯睡覺耶"], ["推 ", "sunnyhung   ", ": 印度人有種姓制度，強大會有限制，不會威脅到美國!"], ["推 ", "good5755    ", ": 印度有開放FB YT GG 中國有開放?"], ["噓 ", "johnny9667  ", ": 印度窮成這樣，人均不到兩千，連非洲一些國家都比印"], ["→ ", "johnny9667  ", ": 度有錢了。"], ["噓 ", "iamten      ", ": 美國對印度也不爽好嗎"], ["推 ", "watashiD    ", ": 畢竟中國人口這麼多，你有聽過經理比基層多的公司"], ["→ ", "watashiD    ", ": 嗎"], ["推 ", "boy830527   ", ": 中國一堆企業經理都是title 客戶經理一堆 總監一堆"], ["→ ", "boy830527   ", ": 而且中國公司很多一天工作12-14小時起跳 假日也在工"], ["→ ", "boy830527   ", ": 作 年薪15-20萬rmb 做業務的不分男女10個9.5個要陪"], ["→ ", "boy830527   ", ": 睡 剩下0.5的是長太醜"], ["噓 ", "pornsp      ", ": 這篇文真的搞不清楚狀況，其實中國已開發或開發中國"], ["→ ", "pornsp      ", ": 家對台灣其實沒差，差別是牠們的態度，印度會去欺壓"], ["→ ", "pornsp      ", ": 其他國家？？會去搞一帶一路？？重點在那邊，請原po"], ["→ ", "tym44       ", ": 這麼厲害的國當然是發達國家"], ["→ ", "pornsp      ", ": 回去再唸點書好嗎？"], ["推 ", "nk10803     ", ": 很多沿海一帶的台資都慢慢被趕進內陸去zzzz"], ["推 ", "killerking05", ": 印度對巴基斯坦很好?那是印度現在不夠強而已"], ["噓 ", "hb0922      ", ": 呵呵 捧印度就扯蛋了 無腦綠"], ["→ ", "dragonjj    ", ": 已發展國家並沒有明確定義喔"], ["推 ", "chriter     ", ": Project Mausam不就是為了反制一帶一路而來的"], ["噓 ", "johnny9667  ", ": 無腦綠"], ["推 ", "KarlTowns   ", ": 印度野心比中國大多了，周圍都想併吞，尼泊爾、巴基"], ["推 ", "kusomanfcu  ", ": 人一綠腦就"], ["噓 ", "miketk      ", ": 管人家怎樣。有人弄台灣的敵人就是爽啦。 囉哩八唆"], ["→ ", "miketk      ", ": 一堆"], ["→ ", "miketk      ", ": 管他印度美國怎樣。 有人弄中共就是爽。"], ["→ ", "sohopro     ", ": 是強國就不要再逃避責任"]]}, {"artLink": "/bbs/Stock/M.1559901487.A.766.html", "artAuthor": "b777300", "artTitle": "Re: [新聞] 經濟部盼鬆綁7休1 勞動部下周三討論", "artDate": "1559901487", "getContent": "N", "artBody": "作者b777300 (su35s)看板Stock標題Re: [新聞] 經濟部盼鬆綁7休1 勞動部下周三討論時間Fri Jun  7 17:58:06 2019\n※ 引述《cjol (勤樸)》之銘言：\n: ※ [本文轉錄自 cjol 信箱]\n: 作者: KKKKJAY (KJ) 看板: Gossiping\n: 標題: [新聞] 經濟部盼鬆綁7休1 勞動部下周三討論\n: 時間: Fri Jun  7 11:57:19 2019\n: 1.媒體來源:\n: 中時\n: 2.記者署名\n: 游昇俯\n: 3.完整新聞標題:\n: 經濟部盼鬆綁7休1 勞動部下周三討論\n: 4.完整新聞內文:\n: 因應陸美貿易戰衝擊，可能衍生急單生產需求，經濟部盼包括印刷電路板在內等11類製造\n: 業能鬆綁例假七休一規定，勞動部下周三（12日）將召集勞動基準諮詢會討論。對此，勞\n: 團昨批評都是勞基法修惡開了後門，使廠商一有人力需求就想鬆綁，像是中了木馬病毒擴\n: 散，盼勞動部拒絕讓資方予取予求。\n: 經濟部此次提案鬆綁輪班換班間距及例假七休一適用行業，包括印刷電路板、電子零組件\n: 、玻璃、水泥及混凝土製品、塑膠製品、印刷及其輔助、黏土建築材料、食品、金屬製品\n: 、機械設備及電線電纜等製造業。經濟部並希望變更休息時間不少於連續8小時。\n: 對此，台灣勞工陣線祕書長孫友聯表示，廠商既已預期到業務可能增長，就應該好好規畫\n: 人力，而不是遇到急單、轉單就把腦筋動到勞工的休息權上，以為鬆綁七休一就能解決問\n: 題，難道這些廠商就不擔心過勞讓員工跑掉，縱使有急單也沒人可做？\n: 孫友聯指出，都怪《勞基法》二修開了後門，像是中了木馬病毒一般一直擴散，讓廠商每\n: 有人力需求就想鬆綁七休一，希望勞動部拒絕讓資方予取予求。\n: 5.完整新聞連結 (或短網址):\n: https://www.chinatimes.com/newspapers/20190607000480-260106?chdtv\n: 6.備註:\n: 逢中美戰勞力鬆綁\n: 印刷電路板、電子零組件、玻璃、水泥及混凝土製品、塑膠製品、印刷及其輔助、黏土建\n: 築材料、食品、金屬製品、機械設備及電線電纜等製造業大利多\n: 大家要加碼哪隻？？\n\n一來一往，一切回到原點………咦！我的七天假呢？\n\n可憐台灣勞工，選前心頭肉，選後砧板肉～\n\n反正台灣人民都是健忘的～一個月後就忘嘍～\n\n………………\n\n請記得台灣沒有過勞，勞工過勞死是本來就有病！\n\n--\n※ 發信站: 批踢踢實業坊(ptt.cc), 來自: 42.73.201.174 (臺灣)\n※ 文章網址: https://www.ptt.cc/bbs/Stock/M.1559901487.A.766.html\n推 SweetLee    : 還七天假? 週休二日後就沒七天假了吧 不然你拿週休 06/07 18:01\n→ SweetLee    : 二日去換七天假啊 06/07 18:01\n→ chaoms      : 都快二十年的事… 06/07 18:03\n→ fauck       : 本來就沒有七天假 政府又為何要砍 去了解根源好嗎 06/07 18:18\n推 capirex     : 小英選前就說勞工假太多 當然要砍啊 06/07 18:19\n噓 jjmath224   : 最終目標收走七天假，加班過勞死 got it 06/07 18:19\n推 suyisan     : 一樓邏輯可笑，七天假不重要的話何必改？ 06/07 18:23\n推 x111222333  : 支持！勞工想發大財，還想拿七天假，根本貪婪 06/07 18:28\n→ henrk       : 改到現在就有人開始說沒七天假，是好騙還是在其中 06/07 18:47\n噓 kenbbc12321 : 你可以辭職不要做，那就有放不完的假 06/07 18:54\n噓 rayven      : 還在7天假，怎不乾脆開除老闆永遠放假 06/07 19:12\n→ rayven      : 勞賊就是要加薪不敢找老闆卻上街要求政府對老闆施壓 06/07 19:14\n推 alsoty      : 專職就可以無限放假 06/07 19:16\n→ chaoms      : 到底有多少人不知道七天假快二十年了？ 06/07 19:25\n推 std910866e  : 科技業普遍有七天假.... 06/07 19:46\n噓 insen001    : 空心菜 以為自己嬴定了是吧 06/07 19:57\n噓 ZxoF        : 沒放過七天假無感 06/07 19:59\n", "artBodyLink": ["https://www.chinatimes.com/newspapers/20190607000480-260106?chdtv", "https://www.ptt.cc/bbs/Stock/M.1559901487.A.766.html"], "artCmt": [["推 ", "SweetLee    ", ": 還七天假? 週休二日後就沒七天假了吧 不然你拿週休"], ["→ ", "SweetLee    ", ": 二日去換七天假啊"], ["→ ", "chaoms      ", ": 都快二十年的事…"], ["→ ", "fauck       ", ": 本來就沒有七天假 政府又為何要砍 去了解根源好嗎"], ["推 ", "capirex     ", ": 小英選前就說勞工假太多 當然要砍啊"], ["噓 ", "jjmath224   ", ": 最終目標收走七天假，加班過勞死 got it"], ["推 ", "suyisan     ", ": 一樓邏輯可笑，七天假不重要的話何必改？"], ["推 ", "x111222333  ", ": 支持！勞工想發大財，還想拿七天假，根本貪婪"], ["→ ", "henrk       ", ": 改到現在就有人開始說沒七天假，是好騙還是在其中"], ["噓 ", "kenbbc12321 ", ": 你可以辭職不要做，那就有放不完的假"], ["噓 ", "rayven      ", ": 還在7天假，怎不乾脆開除老闆永遠放假"], ["→ ", "rayven      ", ": 勞賊就是要加薪不敢找老闆卻上街要求政府對老闆施壓"], ["推 ", "alsoty      ", ": 專職就可以無限放假"], ["→ ", "chaoms      ", ": 到底有多少人不知道七天假快二十年了？"], ["推 ", "std910866e  ", ": 科技業普遍有七天假...."], ["噓 ", "insen001    ", ": 空心菜 以為自己嬴定了是吧"], ["噓 ", "ZxoF        ", ": 沒放過七天假無感"]]}, {"artLink": "/bbs/Stock/M.1559901913.A.754.html", "artAuthor": "lovewenhui", "artTitle": "[心得] 希望下次公投能推出假日電子盤交易", "artDate": "1559901913", "getContent": "N", "artBody": "作者lovewenhui (人來人往都是客)看板Stock標題[心得] 希望下次公投能推出假日電子盤交易時間Fri Jun  7 18:05:11 2019\n如題，國定假日如果又連到六日，好幾天不開盤這樣如果國際上有什麼突發狀況，要如何\n平倉？\n\n大家都知道，期權目的就是避險，百分之99的交易者都是有避險需求者，你在那邊放假，\n其他市場正常交易，如果發生什麼狀況裡面有部位的人要怎辦？\n\n我相信會上Stock 和Option版的人，有99%是為了避險為了台灣經濟發展才做交易的，只\n有不到1%的人是為了自己的貪婪進來賭博的，希望政府能注重99%交易者的權利，盡快推\n出假日期貨電子盤繼續交易的法案。\nhttps://i.imgur.com/utkdZPz.jpg\n\nhttps://i.imgur.com/yEOSYN3.jpg\n\n如圖所示，期權最最最重要的功能就是避險，以及服務實質經濟，只有極少數（1%）的人\n當作賭博。\n\n--\n※ 發信站: 批踢踢實業坊(ptt.cc), 來自: 42.77.223.234 (臺灣)\n※ 文章網址: https://www.ptt.cc/bbs/Stock/M.1559901913.A.754.html\n推 winniesc    : 看你每次發文都在想假日開盤 股癌喔 06/07 18:08\n→ winniesc    : 期權就是避險？你不是被騙 就是來騙 別害人好嗎？ 06/07 18:08\n推 abcgo       : 你覺得，券商或期貨商，會想多花錢嗎？ 06/07 18:11\n→ rockken     : 1% 當賭徒我都笑了 06/07 18:14\n推 ethan0419   : 很想吃時間吼? 06/07 18:16\n推 joy2105feh  : 玩期貨的才多少人 就算提案怎麼可能會過 腦袋還好嗎 06/07 18:17\n→ lovewenhui  : 請正名「交易」期貨，不是「玩」期貨。 06/07 18:18\n推 r2038182    : 歐美國定假日也休息啊 06/07 18:21\n噓 darkMood    : 該來的避不掉 06/07 18:26\n噓 whisty216   : 當大家不用放假 06/07 18:28\n噓 s11qs4      : 不需要 06/07 18:31\n噓 zombiepigman: 每天看盤就很累很緊張了 兩天不看休息不過分吧 06/07 18:40\n→ lion198     : 模台今天有開啊 06/07 18:40\n→ ruln        : 不是有其他版？ 06/07 18:41\n推 a1379       : 歐美國定假日也沒開盤啊 06/07 18:42\n噓 wxes30431   : 從業人員都不用休息？ 06/07 18:45\n噓 bamama56    : 你出薪水啊 06/07 18:58\n推 Lowpapa     : 傻空關廁所   噴到哭 06/07 18:58\n噓 raccoon1234 :  https://i.imgur.com/KqQJLU6.jpg 06/07 19:00\n→ lynchen     : 避險單跟假日有什麼關係 06/07 19:05\n→ lynchen     : 反向避險單是基本的吧 06/07 19:06\n→ pillowkiller: 怎麼感覺這文看到很多次 06/07 19:09\n推 dnm08       : 我推午休，分上下午盤。 06/07 19:10\n→ redbeanbread: 歐美都沒了 06/07 19:13\n噓 redbeanbread: 1/6才發過一樣的文 不要手動置底 06/07 19:15\n推 heavenbeyond: 我還真沒想過有人進股市是為了台灣經濟發展。 06/07 19:19\n噓 PoloHuang   : 股癌 06/07 19:29\n噓 may0723     : 閱... 06/07 19:30\n→ padye       : 不會假日前一天平倉喔？ 06/07 19:39\n噓 ataky       : 放心 連公投的機會都不會有 06/07 19:39\n噓 kamio       : 避險單又不會只下單向 想反串？ 06/07 19:49\n噓 kolinru     : 你去玩BTC就好了 06/07 20:00\n", "artBodyLink": ["https://i.imgur.com/utkdZPz.jpg", "//imgur.com/utkdZPz", "https://i.imgur.com/yEOSYN3.jpg", "//imgur.com/yEOSYN3", "https://www.ptt.cc/bbs/Stock/M.1559901913.A.754.html", "https://i.imgur.com/KqQJLU6.jpg", "//imgur.com/KqQJLU6"], "artCmt": [["推 ", "winniesc    ", ": 看你每次發文都在想假日開盤 股癌喔"], ["→ ", "winniesc    ", ": 期權就是避險？你不是被騙 就是來騙 別害人好嗎？"], ["推 ", "abcgo       ", ": 你覺得，券商或期貨商，會想多花錢嗎？"], ["→ ", "rockken     ", ": 1% 當賭徒我都笑了"], ["推 ", "ethan0419   ", ": 很想吃時間吼?"], ["推 ", "joy2105feh  ", ": 玩期貨的才多少人 就算提案怎麼可能會過 腦袋還好嗎"], ["→ ", "lovewenhui  ", ": 請正名「交易」期貨，不是「玩」期貨。"], ["推 ", "r2038182    ", ": 歐美國定假日也休息啊"], ["噓 ", "darkMood    ", ": 該來的避不掉"], ["噓 ", "whisty216   ", ": 當大家不用放假"], ["噓 ", "s11qs4      ", ": 不需要"], ["噓 ", "zombiepigman", ": 每天看盤就很累很緊張了 兩天不看休息不過分吧"], ["→ ", "lion198     ", ": 模台今天有開啊"], ["→ ", "ruln        ", ": 不是有其他版？"], ["推 ", "a1379       ", ": 歐美國定假日也沒開盤啊"], ["噓 ", "wxes30431   ", ": 從業人員都不用休息？"], ["噓 ", "bamama56    ", ": 你出薪水啊"], ["推 ", "Lowpapa     ", ": 傻空關廁所   噴到哭"], ["噓 ", "raccoon1234 ", ":  https://i.imgur.com/KqQJLU6.jpg"], ["→ ", "lynchen     ", ": 避險單跟假日有什麼關係"], ["→ ", "lynchen     ", ": 反向避險單是基本的吧"], ["→ ", "pillowkiller", ": 怎麼感覺這文看到很多次"], ["推 ", "dnm08       ", ": 我推午休，分上下午盤。"], ["→ ", "redbeanbread", ": 歐美都沒了"], ["噓 ", "redbeanbread", ": 1/6才發過一樣的文 不要手動置底"], ["推 ", "heavenbeyond", ": 我還真沒想過有人進股市是為了台灣經濟發展。"], ["噓 ", "PoloHuang   ", ": 股癌"], ["噓 ", "may0723     ", ": 閱..."], ["→ ", "padye       ", ": 不會假日前一天平倉喔？"], ["噓 ", "ataky       ", ": 放心 連公投的機會都不會有"], ["噓 ", "kamio       ", ": 避險單又不會只下單向 想反串？"], ["噓 ", "kolinru     ", ": 你去玩BTC就好了"]]}, {"artLink": "/bbs/Stock/M.1559902077.A.8F4.html", "artAuthor": "hito21", "artTitle": "[標的] 美國道瓊(*UDM9)", "artDate": "1559902077", "getContent": "N", "artBody": "作者hito21 (come3哈密瓜)看板Stock標題[標的] 美國道瓊(*UDM9)時間Fri Jun  7 18:07:55 2019\n1. 標的：美國道瓊(*UDM9) or台道瓊\n\n2. 分類：多/空/請益/心得\n請益 用來分享夜盤~\n\n3. 分析/正文：\n道瓊 強勢反轉第四天... 走勢又兇又猛...\n這幾天就是不要跟趨勢做對的最好例子...雖然數據消息爛到發光~\n下午德股也是...出口數據不忍...但表空軍~ 歐元區繼續high降息&再融資...\n\n原油昨夜03:00點急拉過53...先於小道反應!!!\n讓能源股受上揚影響扭轉頹勢帶動美股上行。(美墨談判\"假\"消息!!!\n但消息是假基本庫存沒降...讓我悶繼續看下去 (55-52.5-50)\n(長期看還是等51.5破 就下看50... 不建議追高...波動很大小心~\n俄 歐佩客 阿拉伯 預計減產計劃~ 但美國不一定跟~\n\n新聞方面:\n川普:不加息的話市場可能將上漲10000點~ (上週我被騙一次...Orz...\n\n墨外交部長：將繼續關稅談判~ \"未達成協議\"\n(川普沒換到邊境問題解決前都會緩兵之計)\n\nG20行情可以留意一下...上次死亡之握(去年十月)後開始you know~\n\n重點來啦...晚上小道瓊 還是\"看漲\"不追高! 預計非農不會太好...\n除非爆炸性的<2這種 不然...走衝高後的回落 或修正到支撐區機會高...\n非農開獎前會再小小拉...700-730-775-813-900-950 (若676破 多單建議全出!\n\"科技股\"晚上打老虎!!! 小心!!!\n\n4. 進退場機制：(非長期投資者，必須有停損機制)\n空手 等這波漲勢結束在進場... 粽子節祝大家多空都賺錢...\n\n--\n※ 發信站: 批踢踢實業坊(ptt.cc), 來自: 220.136.146.155 (臺灣)\n※ 文章網址: https://www.ptt.cc/bbs/Stock/M.1559902077.A.8F4.html\n→ hito21      : 送分題... 希望那個有天份的網友下次分享一下 不忍~ 06/07 18:08\n推 beta0907    : 送分題是今天會大崩盤嗎 0.0 06/07 18:11\n推 adsl33394   : 今天也太早開惹 06/07 18:11\n→ lex66688    : 吃粽子 沒手下單！ 看戲 06/07 18:12\n→ beta0907    : 話說u大怎麼預測昨天上700今天回測350的XD 06/07 18:13\n→ hito21      : 多軍守775or 730都還是多軍講話... 06/07 18:15\n噓 kobe7785075 : http://i.imgur.com/WuEhcIX.jpg 06/07 18:15\n→ hito21      : 晚上科技股才是主角...小心~ 06/07 18:16\n→ hito21      : 早點開預測再前...讓華爾街參考XD 06/07 18:16\n→ hito21      : 晚上科技股好的話~很難跌阿XD 06/07 18:20\n推 Dumbbbb     : 開的爛也是拉回一下再繼續噴 多多不怕 0.0 06/07 18:20\n推 beta0907    : 暴龍哭哭 06/07 18:21\n→ beta0907    : 我也預感今天怎樣都會噴 0.0 06/07 18:21\n推 cpz         : 天份不夠，打老虎的意思是什麼？ 06/07 18:22\n→ hito21      : 硬嘎機會高...雖然還是價量小小背離很曖昧... 06/07 18:22\n→ hito21      : cpz科技股晚上有機會反彈...會很兇~我猜的參考就好 06/07 18:23\n推 cpz         : 感謝你：） 06/07 18:24\n推 Dumbbbb     : 科技股都是跌多反彈也快 目前點位真的很甜 06/07 18:25\n推 u8728049    : beta大因爲每次非農都是300多點來回阿XD不過今天噴 06/07 18:25\n→ u8728049    : 成這樣應該不可能了～設定h大神秘數字813沒碰到，81 06/07 18:25\n→ u8728049    : 4就反彈到836，殘念@@ 06/07 18:25\n→ hito21      : u8晚上也很劇烈小心...波動應該不小~ 06/07 18:30\n推 u8728049    : 錯邊就噗冷了～ 06/07 18:31\n→ hito21      : 20:30 開獎!!! 06/07 18:31\n推 kaiming7955 : 這波拉到拉不動後準備一起GG 06/07 18:33\n推 sha3098     : 量縮好控盤..... 06/07 18:33\n推 Jerome039   : 我覺得會開差 拉回後繼續噴 反正現在市場心態就是 06/07 18:34\n→ Jerome039   : 爛又怎樣fed會出手 06/07 18:34\n推 Xray2002    : 鼻要再75暴龍惹 06/07 18:35\n推 u8728049    : 活該啊！滿手好牌被別人梭哈XD 06/07 18:37\n推 beta0907    : 暴龍活該啊!!! 06/07 18:37\n→ beta0907    : 感覺今天拉回無腦多能大獲全勝耶 0.0 06/07 18:38\n→ lion198     : 非農優於預期->降息沒望 崩 06/07 18:38\n推 u8728049    : 預期18萬真低～ 06/07 18:39\n推 rocklorl    : 目前市場認為FED會降息，所以大漲。若晚上數據太好 06/07 18:39\n推 Jerome039   : 對...反而優於預期才會崩... 06/07 18:40\n→ rocklorl    : 那反而降息機率變低而跌回吧 06/07 18:40\n推 shouldnt    : 晚上道瓊上看26k 06/07 18:42\n推 tenghui     : 期待星期一的電子狂噴 06/07 18:43\n推 Csir        : 難道只有我賠錢 06/07 18:49\n推 beta0907    : 小道噴那麼高了 希望星期一鴻海能夠漲一下 0.0 06/07 18:51\n推 epson5566   : 今天不會再嘎了 06/07 18:51\n推 shouldnt    : 空軍:還好今天沒開盤。。。。 06/07 18:53\n推 Jerome039   : 結果今天跌 台股下周一繼續跌 06/07 18:56\n推 ji3tlsp4    : 美國承認台灣獨立了，下禮拜台股要噴惹！！ 06/07 18:57\n→ ji3tlsp4    : 禮拜二記得跑！怕中共射一顆飛彈...反手做！ 06/07 18:58\n推 win1109     : 現在噴這麼多，晚上數據好，直接上27000 06/07 18:59\n推 win1109     : 人家美國出個炒股總統，指數一直創高，我們菜桶自己 06/07 19:01\n→ win1109     : 都嫁不掉，還有空關心志林婚姻。 06/07 19:01\n→ beminaru    : 救救VIX 06/07 19:05\n推 Dumbbbb     : 盤前好保守 都在等數據開 XDDD 06/07 19:05\n噓 s11qs4      : 噴 06/07 19:06\n推 gbman       : 會噴過季線XD 06/07 19:15\n推 beta0907    : 這態勢不過季線不OK阿 06/07 19:16\n推 epson5566   : 週五 非農 還能量縮 我也是醉了 06/07 19:17\n推 tkjj90017   : 每天空手...怎麼幹大事...我又來送分啦 06/07 19:18\n推 Csir        : 季線是多少啊QQ 06/07 19:23\n推 Jerome039   : 25950? 06/07 19:24\n推 ilw4e       : 非農不好->降息預期->漲;非農好->經濟火熱->漲。要 06/07 19:28\n→ ilw4e       : 漲怎樣都有理由漲 06/07 19:28\n推 ji3tlsp4    : 樓上有道理！基本上只要不是很明顯的利空消息，道 06/07 19:36\n→ ji3tlsp4    : 瓊做多幾乎都賺！ 06/07 19:36\n推 beta0907    : 無懸念就是噴 06/07 19:37\n推 Dumbbbb     : 美股走了100多年的多頭 做多？做空？ 06/07 19:37\n推 Dumbbbb     : 長期就是往上走 短期震盪抱得住都是賺 06/07 19:38\n推 ji3tlsp4    : 可以回頭看看呀！這是真的，之前像歐債問題或貿易 06/07 19:39\n→ ji3tlsp4    : 戰問題以外，道瓊做多至少8成勝率！ 06/07 19:39\n→ ji3tlsp4    : 起碼在川普宣布是否課另外3000億關稅之前，我認為道 06/07 19:40\n→ ji3tlsp4    : 瓊都該做多為主！ 06/07 19:40\n推 kenbbc12321 : 道瓊無腦多必勝 06/07 19:40\n推 Dumbbbb     : 運氣好買在金融風暴前最高點 過三年還能賺快20趴喔 06/07 19:41\n→ ji3tlsp4    : 也不算必勝啦，就是勝率非常高...所以......一時抄 06/07 19:41\n→ ji3tlsp4    : 底一時爽！ 06/07 19:41\n推 gbman       : 本多忠勝XD 06/07 19:45\n推 ji3tlsp4    : 台指期昨晚有大戶在進貨，端午前又跌這麼多...而且 06/07 19:45\n→ ji3tlsp4    : 這幾天道瓊一直漲，我認為下禮拜一會噴！不噴也會 06/07 19:45\n→ ji3tlsp4    : 反彈一些！ 06/07 19:45\n→ gbman       : 開高走低87% XD 06/07 19:46\n推 ji3tlsp4    : 開高那就要反手做了xd 06/07 19:46\n推 Csir        : 這次拉這麼快一定有鬼  空回22000 06/07 19:47\n→ ji3tlsp4    : 不可能啦，蔡英文應該爽爆了！美國宣布台灣是獨立 06/07 19:47\n→ ji3tlsp4    : 國家，下禮拜一蔡英文可能讓台股噴的！ 06/07 19:47\n推 beta0907    : 短均線太強勢 今晚一定噴 06/07 19:49\n推 F0r         : 昨天已經說了 空軍保重 06/07 19:54\n→ F0r         : 做多昨天都不知道賺幾點了 06/07 19:55\n→ bluechm     : Beta作多或空 06/07 19:56\n", "artBodyLink": ["https://www.ptt.cc/bbs/Stock/M.1559902077.A.8F4.html", "http://i.imgur.com/WuEhcIX.jpg", "//imgur.com/WuEhcIX"], "artCmt": [["→ ", "hito21      ", ": 送分題... 希望那個有天份的網友下次分享一下 不忍~"], ["推 ", "beta0907    ", ": 送分題是今天會大崩盤嗎 0.0"], ["推 ", "adsl33394   ", ": 今天也太早開惹"], ["→ ", "lex66688    ", ": 吃粽子 沒手下單！ 看戲"], ["→ ", "beta0907    ", ": 話說u大怎麼預測昨天上700今天回測350的XD"], ["→ ", "hito21      ", ": 多軍守775or 730都還是多軍講話..."], ["噓 ", "kobe7785075 ", ": http://i.imgur.com/WuEhcIX.jpg"], ["→ ", "hito21      ", ": 晚上科技股才是主角...小心~"], ["→ ", "hito21      ", ": 早點開預測再前...讓華爾街參考XD"], ["→ ", "hito21      ", ": 晚上科技股好的話~很難跌阿XD"], ["推 ", "Dumbbbb     ", ": 開的爛也是拉回一下再繼續噴 多多不怕 0.0"], ["推 ", "beta0907    ", ": 暴龍哭哭"], ["→ ", "beta0907    ", ": 我也預感今天怎樣都會噴 0.0"], ["推 ", "cpz         ", ": 天份不夠，打老虎的意思是什麼？"], ["→ ", "hito21      ", ": 硬嘎機會高...雖然還是價量小小背離很曖昧..."], ["→ ", "hito21      ", ": cpz科技股晚上有機會反彈...會很兇~我猜的參考就好"], ["推 ", "cpz         ", ": 感謝你：）"], ["推 ", "Dumbbbb     ", ": 科技股都是跌多反彈也快 目前點位真的很甜"], ["推 ", "u8728049    ", ": beta大因爲每次非農都是300多點來回阿XD不過今天噴"], ["→ ", "u8728049    ", ": 成這樣應該不可能了～設定h大神秘數字813沒碰到，81"], ["→ ", "u8728049    ", ": 4就反彈到836，殘念@@"], ["→ ", "hito21      ", ": u8晚上也很劇烈小心...波動應該不小~"], ["推 ", "u8728049    ", ": 錯邊就噗冷了～"], ["→ ", "hito21      ", ": 20:30 開獎!!!"], ["推 ", "kaiming7955 ", ": 這波拉到拉不動後準備一起GG"], ["推 ", "sha3098     ", ": 量縮好控盤....."], ["推 ", "Jerome039   ", ": 我覺得會開差 拉回後繼續噴 反正現在市場心態就是"], ["→ ", "Jerome039   ", ": 爛又怎樣fed會出手"], ["推 ", "Xray2002    ", ": 鼻要再75暴龍惹"], ["推 ", "u8728049    ", ": 活該啊！滿手好牌被別人梭哈XD"], ["推 ", "beta0907    ", ": 暴龍活該啊!!!"], ["→ ", "beta0907    ", ": 感覺今天拉回無腦多能大獲全勝耶 0.0"], ["→ ", "lion198     ", ": 非農優於預期->降息沒望 崩"], ["推 ", "u8728049    ", ": 預期18萬真低～"], ["推 ", "rocklorl    ", ": 目前市場認為FED會降息，所以大漲。若晚上數據太好"], ["推 ", "Jerome039   ", ": 對...反而優於預期才會崩..."], ["→ ", "rocklorl    ", ": 那反而降息機率變低而跌回吧"], ["推 ", "shouldnt    ", ": 晚上道瓊上看26k"], ["推 ", "tenghui     ", ": 期待星期一的電子狂噴"], ["推 ", "Csir        ", ": 難道只有我賠錢"], ["推 ", "beta0907    ", ": 小道噴那麼高了 希望星期一鴻海能夠漲一下 0.0"], ["推 ", "epson5566   ", ": 今天不會再嘎了"], ["推 ", "shouldnt    ", ": 空軍:還好今天沒開盤。。。。"], ["推 ", "Jerome039   ", ": 結果今天跌 台股下周一繼續跌"], ["推 ", "ji3tlsp4    ", ": 美國承認台灣獨立了，下禮拜台股要噴惹！！"], ["→ ", "ji3tlsp4    ", ": 禮拜二記得跑！怕中共射一顆飛彈...反手做！"], ["推 ", "win1109     ", ": 現在噴這麼多，晚上數據好，直接上27000"], ["推 ", "win1109     ", ": 人家美國出個炒股總統，指數一直創高，我們菜桶自己"], ["→ ", "win1109     ", ": 都嫁不掉，還有空關心志林婚姻。"], ["→ ", "beminaru    ", ": 救救VIX"], ["推 ", "Dumbbbb     ", ": 盤前好保守 都在等數據開 XDDD"], ["噓 ", "s11qs4      ", ": 噴"], ["推 ", "gbman       ", ": 會噴過季線XD"], ["推 ", "beta0907    ", ": 這態勢不過季線不OK阿"], ["推 ", "epson5566   ", ": 週五 非農 還能量縮 我也是醉了"], ["推 ", "tkjj90017   ", ": 每天空手...怎麼幹大事...我又來送分啦"], ["推 ", "Csir        ", ": 季線是多少啊QQ"], ["推 ", "Jerome039   ", ": 25950?"], ["推 ", "ilw4e       ", ": 非農不好->降息預期->漲;非農好->經濟火熱->漲。要"], ["→ ", "ilw4e       ", ": 漲怎樣都有理由漲"], ["推 ", "ji3tlsp4    ", ": 樓上有道理！基本上只要不是很明顯的利空消息，道"], ["→ ", "ji3tlsp4    ", ": 瓊做多幾乎都賺！"], ["推 ", "beta0907    ", ": 無懸念就是噴"], ["推 ", "Dumbbbb     ", ": 美股走了100多年的多頭 做多？做空？"], ["推 ", "Dumbbbb     ", ": 長期就是往上走 短期震盪抱得住都是賺"], ["推 ", "ji3tlsp4    ", ": 可以回頭看看呀！這是真的，之前像歐債問題或貿易"], ["→ ", "ji3tlsp4    ", ": 戰問題以外，道瓊做多至少8成勝率！"], ["→ ", "ji3tlsp4    ", ": 起碼在川普宣布是否課另外3000億關稅之前，我認為道"], ["→ ", "ji3tlsp4    ", ": 瓊都該做多為主！"], ["推 ", "kenbbc12321 ", ": 道瓊無腦多必勝"], ["推 ", "Dumbbbb     ", ": 運氣好買在金融風暴前最高點 過三年還能賺快20趴喔"], ["→ ", "ji3tlsp4    ", ": 也不算必勝啦，就是勝率非常高...所以......一時抄"], ["→ ", "ji3tlsp4    ", ": 底一時爽！"], ["推 ", "gbman       ", ": 本多忠勝XD"], ["推 ", "ji3tlsp4    ", ": 台指期昨晚有大戶在進貨，端午前又跌這麼多...而且"], ["→ ", "ji3tlsp4    ", ": 這幾天道瓊一直漲，我認為下禮拜一會噴！不噴也會"], ["→ ", "ji3tlsp4    ", ": 反彈一些！"], ["→ ", "gbman       ", ": 開高走低87% XD"], ["推 ", "ji3tlsp4    ", ": 開高那就要反手做了xd"], ["推 ", "Csir        ", ": 這次拉這麼快一定有鬼  空回22000"], ["→ ", "ji3tlsp4    ", ": 不可能啦，蔡英文應該爽爆了！美國宣布台灣是獨立"], ["→ ", "ji3tlsp4    ", ": 國家，下禮拜一蔡英文可能讓台股噴的！"], ["推 ", "beta0907    ", ": 短均線太強勢 今晚一定噴"], ["推 ", "F0r         ", ": 昨天已經說了 空軍保重"], ["→ ", "F0r         ", ": 做多昨天都不知道賺幾點了"], ["→ ", "bluechm     ", ": Beta作多或空"]]}, {"artLink": "/bbs/Stock/M.1559902765.A.823.html", "artAuthor": "anti87", "artTitle": "[新聞] 中俄強化「全面戰略協作」美國擔憂：中俄", "artDate": "1559902765", "getContent": "N", "artBody": "作者anti87 (天機老人)看板Stock標題[新聞] 中俄強化「全面戰略協作」美國擔憂：中俄時間Fri Jun  7 18:19:18 2019\nhttps://www.storm.mg/article/1364407\n\n中俄強化「全面戰略協作」美國擔憂：中俄協調行動，美國面臨兩線作戰\n\n國領導人習近平在中美貿易戰正酣之際，高調訪問俄羅斯並出席聖彼得堡國際經濟論壇。\n習近平訪問期間，兩國領導人宣布發展中俄全面戰略協作夥伴關係，還宣示共同維護全球\n戰略穩定，在國際事務上貢獻「中俄方案」。在北京與莫斯科軸心強化之際，美國與中俄\n關係同時惡化引發美國安全專家的關切。他們尤其擔心中俄之間採取協調性的戰略行動，\n從而使美國不得不同時在東歐和西太平洋面臨兩線作戰。\n\n中美貿易戰正酣，習近平高調出訪俄羅斯\n\n中國領導人習近平對俄羅斯進行的國是訪問正值中俄兩國建交70周年，是他在中美交惡以\n及美俄關係繼續處於低谷時進行訪問，也是他在中美兩國展開新一輪貿易戰之後的首次重\n要出訪。\n\n除了國是訪問，習近平還率領隨行的1000多名官員和商界人士出席聖彼得堡國際經濟論壇\n，成為這個俄羅斯年度投資論壇的主角，而美國駐俄羅斯大使洪博培因為俄羅斯今年2月\n逮捕一名美國投資銀行家而抵制這次論壇。\n\n中俄建立新時代全面戰略協作夥伴關係\n\n在習近平訪問俄羅斯期間，雙方發表了《關於發展新時代全面戰略協作夥伴關係的聯合聲\n明》。聲明列出了當前中俄關係的主要特徵：高度的政治互信；完備的高層交往和各領域\n合作機制；內容豐富、具有戰略意義的務實合作；堅實的世代友好民意基礎以及密切有效\n的國際協調。\n\n\n克里姆林宮公布的數據顯示，中俄貿易去年幾乎成長了25%，總貿易額達到1008億美元，\n突破了1000億美元的關口。\n\n從貢獻「中國方案」到「中俄方案」\n習近平在與俄羅斯總統普京舉行會談時說，當前的中俄關係處於歷史最好時期，在身處世\n界百年未有之大變局之際，中方願意同俄方共同努力，在國際事務中貢獻更多的「中俄方\n案」。\n\n在訪問期間，習近平與普京除了宣布發展新時代全面戰略協作夥伴關係以外，還宣示要共\n同維護全球戰略穩定。習近平說，這項聲明「在當前具有特殊重要意義」，體現了「中俄\n的擔當精神和兩國戰略協作的積極效應」。\n\n俄羅斯公司與華為簽署5G合約\n在雙方簽署的經濟合作協議中，特別引人矚目的是俄羅斯最大運營商俄羅斯移動電信系統\n公司（MTS）與中國電信業巨頭華為簽署的5G合約。美國目前正以安全為由全力阻止其他\n國家使用華為設備。MTS總裁兼執行長孔亞（Alexey Kornya）在一份聲明中說，與華為的\n協議不僅可以為俄羅斯開發出商用5G網絡，還將「為俄羅斯和中國間發展更加緊密的經濟\n關係做出貢獻」。\n\n習近平：普京是我最親密的朋友\n俄羅斯總統普京2014年在莫斯科因吞併克里米亞而受到西方經濟制裁與孤立之際宣布向亞\n洲轉向，之後中俄關係出現顯著改善。\n\n兩國領導人頻繁互訪。這是習近平連任國家主席以來首次對俄羅斯進行國是訪問，也是\n2013年以來第八次訪問俄羅斯。習近平與普京會面的次數超過了任何其他國家領導人之間\n的見面次數。習近平在接受聖彼得堡國立大學授予榮譽博士學位的典禮上說：「普京是中\n國人民的好朋友、老朋友，也是我最親密的朋友。」\n《紐約時報》的報導說，習近平在中俄與美國的關係都持續緊張的時候訪問俄羅斯，凸顯\n了北京與莫斯科軸心的強化。\n\n杜如松：特別擔憂中俄協調戰略行動\n華盛頓布魯金斯研究院的布魯金斯─耶魯博士後研究員杜如松（Rush Doshi）對中俄之間\n日益密切的合作感到擔憂。\n\n他日前在布魯金斯研究院的一個研討會上談到習近平訪問俄羅斯時表示：「我們看到，從\n1990年代中期開始，他們之間的親密程度就在穩步上升，這已經持續很長一段時間了。我\n認為，目前這種關係有更多軍事方面的內容。在通常的武器銷售以外，我聽說雙方在電子\n戰領域也進行更多訓練。這是我很擔心的事。我最關切的是雙方之間的協調性戰略行動。\n如果我們看到中國在東海採取行動而俄羅斯同時在波羅的海採取行動的話，那麼我們就面\n臨著兩條戰線的問題。」\n\n新美國安全中心（CNAS）跨大西洋安全計畫的高級研究員坎代爾─泰勒（Andrea\nKendall-Taylor）和美國國際共和黨研究所的高級顧問沙爾曼（David Shullman）指出，\n中俄雙方在投資、運輸、航天導航以及開發具有潛在軍事應用的敏感技術等領域都在密切\n合作。在他們看來，中俄關係的日益密切的確給美國軍方帶來潛在的挑戰。\n\n他們在《外交事務》雜誌上撰文說，「這兩個國家可能永遠也不會建立正式的軍事聯盟，\n但他們可能以令美國頭痛的方式聯合行動。例如，中國可能會在俄羅斯進一步入侵烏克蘭\n的同時採取積極舉措，支持其在南海的主權要求。美國軍隊將難以有效應對這兩種戰略。\n」\n\n歐漢龍：美國應避免對小規模衝突做出過度反應\n\n布魯金斯研究院的高級研究員歐漢龍（Michael O'Hanlon）認為，美國需要避免他所稱的\n「釣魚島悖論」，亦即對小規模或是厲害關係不大的衝突做出過度反應；以避免在東歐和\n西太平洋兩條戰線上同時對付俄羅斯和中國。\n\n這位安全問題專家日前在一個研討會上表示：「（避免做出過度反應）最主要是因為你不\n希望看到局勢惡化與大國戰爭，也因為你不能把所有的力量都投入到西太平洋，從而為普\n京提供在波羅的海為所欲為的機會。」\n\n在他看來，美國既需採取外交手段，也需展現軍事決心，二者缺一不可，無法相互替代。\n\n羅德：美在美中俄三角關係中的地位惡化\n\n前美國駐華大使羅德（Winston Lord）也對美國在美中俄三角關係中的劣勢地位感到擔憂\n，儘管他不認為中俄會建立長期同盟關係。\n羅德日前在威爾遜國際學者中心參加座談會時表示，1969年蘇聯陳兵中俄邊境，儘管華盛\n頓與北京當時並沒有外交關係，但美國總統尼克森與國家安全顧問季辛吉決定站在中國一\n邊，就是出於這樣一個戰略考量，即在美中俄這個三角關係中，美國和這兩個國家的關係\n要比他們之間的關係更好。\n\n他說：「不幸的是，今天的情況正好相反。在今天的三角關係中，我們處於最糟糕的狀態\n。我不認為中俄會建立長期的聯盟，矛盾太多了。但很明顯，在這個三角關係中，我們現\n在的狀態比40年前差了很多。」\n\n厄哈德：中俄永遠也不會走到一起\n不過，華盛頓的防務研究機構長期戰略集團負責防務戰略的副主席厄哈德（Thomas\nErhard）說，在大家都在談論美國必須避免俄羅斯和中國走到一起，但他想要的恰恰相反\n。\n他在布魯金斯研究院的研討會上說：「我希望我們能夠在戰略上務實和讓人害怕，從而促\n使他們走到一起。他們真的是很糟糕的朋友。他們不擅長做彼此的朋友。他們都記憶 著\n持續了上千年的敵意。他們永遠也不會走到一起。我對他們目前的日益接近一點也不介意\n。」（相關報導：誰是北美洲原住民的祖先？最新研究：俄羅斯西伯利亞神秘古代人可望\n解開謎團！｜更多文章）\n\n這位擔任過國防部高級戰略顧問的專家同時表示，美國需要盡可能加強對中國和俄羅斯這\n兩個戰略競爭對手瞭解的深度與精細度，這是全方位的，包括經濟、政治、社會、文化和\n軍事層面。在他看來，美國對中國與俄羅斯的瞭解，遠遠不如俄羅斯和中國對美國的瞭解\n\n\ncomment:\n\n  1. 美國就像國際社會上的惡霸，要聯合其他人孤立別人\n     結果自己被國際社會孤立\n\n  2. 中美貿易戰不會太久，抓準川普跪下前的時機，大舉進場買陸股\n     替自己提早規劃財務自由的美好生活\n\n--\n\n 吾開天眼覷紅塵，可憐身是眼中人 http://tinyurl.com/nqprycc \n\n--\n※ 發信站: 批踢踢實業坊(ptt.cc), 來自: 125.224.111.119 (臺灣)\n※ 文章網址: https://www.ptt.cc/bbs/Stock/M.1559902765.A.823.html\n推 samgreco    : 川普跪完英國，接下來會跑去跪德國嗎？ 06/07 18:21\n推 daniel0424  : 廠工：假的 川普聯俄抗中 06/07 18:26\n推 AGODC       : 歐洲國家每次都被打爆才會跟美國求援，這次美國就不 06/07 18:28\n→ AGODC       : 要救歐洲了，讓我大中華跟俄國聯手統一歐洲大陸，厲 06/07 18:28\n→ AGODC       : 害了我的國~ 06/07 18:28\n噓 jay0117     : 黃鼠狼給雞拜年？雞是誰看地圖就知道 06/07 18:29\n推 peterwu4    : 美國自己凹太兇了 06/07 18:33\n噓 jommk       : 風往哪吹呢？ 06/07 18:38\n噓 zombiepigman: 加油 再多割一些地給俄國爸爸 06/07 18:42\n噓 kline       : 一個紙老虎，一個過氣強國 06/07 18:45\n→ gibbs1286   : 普丁：爽啦，感謝川普。不然那個維尼之前還給我拿翹 06/07 18:45\n噓 xup6lin     : 中國精神勝利法 06/07 18:47\n→ gibbs1286   : 我也很希望維尼跟普帝合作，我想看俄國吃中國夠夠 06/07 18:48\n推 HC6         : 美國爸爸請放心，中國會先割地給俄羅斯，賠到吐 06/07 18:50\n推 amego2017   : 科科 不怕雞頭被北級熊給啃了喔 06/07 18:50\n噓 north7      : 支持普帝拿東北! 06/07 18:51\n→ gibbs1286   : 這算與虎謀皮嗎?俄國也不是什麼好東西啊... 06/07 18:52\n推 GODLP       : 呵呵 聯合次要敵人 打擊主要敵人 然後高雄發大財 06/07 18:54\n噓 lockbacker  : 原po這麼推薦了好多篇 怎不po個自己買進的紀錄看看 06/07 18:59\n推 kusomanfcu  : 就舊蘇聯版圖回復而已啊 06/07 19:00\n→ kusomanfcu  : 26要的是東南沿海海權 然後俄羅斯要的是舊蘇聯版圖 06/07 19:01\n推 kusomanfcu  : 歷史上的傳統霸權版圖 06/07 19:03\n推 paleomort   : 美國總是料敵從寬，反觀中國。 06/07 19:03\n推 a29976137   : 原po都賺翻了 06/07 19:04\n推 xo7796      : 俄就是知道中沒什麼朋友想卡油的而已，中國哪時敢 06/07 19:06\n→ xo7796      : 談侵占領地的問題啦？ 06/07 19:06\n噓 ewayne      : 講得好像美國現在沒有在兩面作戰一樣 06/07 19:10\n推 tipsofwarren: 125.224.111.119 (臺灣) 屌打CLV518 06/07 19:11\n噓 sohopro     : 中俄代表國際？ 06/07 19:12\n推 dnm08       : 美推北約制衡俄，推印太戰略打擊中國。 06/07 19:13\n推 kusomanfcu  : 北約喔，被瞎搞前的伊拉克和阿富汗勒？ 06/07 19:17\n推 kusomanfcu  : 北約是和華沙制衡的好嗎？後來就變瞎搞了 06/07 19:20\n噓 bamama56    : 油價一跌俄羅斯就準備崩潰了啦 06/07 19:24\n推 losage      : 我比較好奇簽訂的經濟協議是用什麼計價？美元嗎？ 06/07 19:24\n推 wysptt      : 米國：開三面戰線我都能贏啦 06/07 19:25\n推 afftwc      : 哈，包子帝這次要割不凍港出去了嗎？ 06/07 19:27\n→ deangogi    : 前陣子一堆人在這裡高潮俄羅斯要對中國石油出口加稅 06/07 19:35\n推 cobrasgo    : 我川現在不是向全世界宣戰嗎，怎麼可能只有兩線 06/07 19:38\n", "artBodyLink": ["https://www.storm.mg/article/1364407", "http://tinyurl.com/nqprycc", "https://www.ptt.cc/bbs/Stock/M.1559902765.A.823.html"], "artCmt": [["推 ", "samgreco    ", ": 川普跪完英國，接下來會跑去跪德國嗎？"], ["推 ", "daniel0424  ", ": 廠工：假的 川普聯俄抗中"], ["推 ", "AGODC       ", ": 歐洲國家每次都被打爆才會跟美國求援，這次美國就不"], ["→ ", "AGODC       ", ": 要救歐洲了，讓我大中華跟俄國聯手統一歐洲大陸，厲"], ["→ ", "AGODC       ", ": 害了我的國~"], ["噓 ", "jay0117     ", ": 黃鼠狼給雞拜年？雞是誰看地圖就知道"], ["推 ", "peterwu4    ", ": 美國自己凹太兇了"], ["噓 ", "jommk       ", ": 風往哪吹呢？"], ["噓 ", "zombiepigman", ": 加油 再多割一些地給俄國爸爸"], ["噓 ", "kline       ", ": 一個紙老虎，一個過氣強國"], ["→ ", "gibbs1286   ", ": 普丁：爽啦，感謝川普。不然那個維尼之前還給我拿翹"], ["噓 ", "xup6lin     ", ": 中國精神勝利法"], ["→ ", "gibbs1286   ", ": 我也很希望維尼跟普帝合作，我想看俄國吃中國夠夠"], ["推 ", "HC6         ", ": 美國爸爸請放心，中國會先割地給俄羅斯，賠到吐"], ["推 ", "amego2017   ", ": 科科 不怕雞頭被北級熊給啃了喔"], ["噓 ", "north7      ", ": 支持普帝拿東北!"], ["→ ", "gibbs1286   ", ": 這算與虎謀皮嗎?俄國也不是什麼好東西啊..."], ["推 ", "GODLP       ", ": 呵呵 聯合次要敵人 打擊主要敵人 然後高雄發大財"], ["噓 ", "lockbacker  ", ": 原po這麼推薦了好多篇 怎不po個自己買進的紀錄看看"], ["推 ", "kusomanfcu  ", ": 就舊蘇聯版圖回復而已啊"], ["→ ", "kusomanfcu  ", ": 26要的是東南沿海海權 然後俄羅斯要的是舊蘇聯版圖"], ["推 ", "kusomanfcu  ", ": 歷史上的傳統霸權版圖"], ["推 ", "paleomort   ", ": 美國總是料敵從寬，反觀中國。"], ["推 ", "a29976137   ", ": 原po都賺翻了"], ["推 ", "xo7796      ", ": 俄就是知道中沒什麼朋友想卡油的而已，中國哪時敢"], ["→ ", "xo7796      ", ": 談侵占領地的問題啦？"], ["噓 ", "ewayne      ", ": 講得好像美國現在沒有在兩面作戰一樣"], ["推 ", "tipsofwarren", ": 125.224.111.119 (臺灣) 屌打CLV518"], ["噓 ", "sohopro     ", ": 中俄代表國際？"], ["推 ", "dnm08       ", ": 美推北約制衡俄，推印太戰略打擊中國。"], ["推 ", "kusomanfcu  ", ": 北約喔，被瞎搞前的伊拉克和阿富汗勒？"], ["推 ", "kusomanfcu  ", ": 北約是和華沙制衡的好嗎？後來就變瞎搞了"], ["噓 ", "bamama56    ", ": 油價一跌俄羅斯就準備崩潰了啦"], ["推 ", "losage      ", ": 我比較好奇簽訂的經濟協議是用什麼計價？美元嗎？"], ["推 ", "wysptt      ", ": 米國：開三面戰線我都能贏啦"], ["推 ", "afftwc      ", ": 哈，包子帝這次要割不凍港出去了嗎？"], ["→ ", "deangogi    ", ": 前陣子一堆人在這裡高潮俄羅斯要對中國石油出口加稅"], ["推 ", "cobrasgo    ", ": 我川現在不是向全世界宣戰嗎，怎麼可能只有兩線"]]}, {"artLink": "/bbs/Stock/M.1559906408.A.DCE.html", "artAuthor": "kaube", "artTitle": "[新聞] VLSI技術及電路研討會　台積電發布新興記", "artDate": "1559906408", "getContent": "N", "artBody": "作者kaube (轉眼之間)看板Stock標題[新聞] VLSI技術及電路研討會　台積電發布新興記時間Fri Jun  7 19:20:06 2019\n1.原文連結：\nVLSI技術及電路研討會9日京都登場　台積電發布新興記憶體等重要論文\nhttp://bit.ly/2Wuur7I\n\n\n2.原文內容：\n台積電宣布將在日本舉辦的2019年VLSI技術及電路研討會(2019 Symposia on VLSI\nTechnology & Circuits)發表新興記憶體、二維材料、以及系統整合技術的研究論文。\n\nVLSI技術及電路研討會為微電子領域中頂尖的年度國際會議，2019年將於6月9~14日在日\n本京都舉行，會中邀請台積電發表專篇論文闡述嵌入式磁阻式隨機存取記憶體(eMRAM)的\n研究現況，台積電另有三篇論文也獲得大會肯定選為亮點論文，共同探討2019年研討會的\n主題「將半導體推向極限，實現無縫聯結新世界」。\n\n台積電受邀發表以「嵌入式磁阻式隨機存取記憶體技術近期進展與未來方向」為題的論文\n，闡述一項有望取代即將面臨微縮極限的嵌入式快閃記憶體的技術──非揮發性eMRAM。\n論文陳述了具備銲錫迴焊(SolderReflow)能力的22奈米eMRAM的研究成果，此項技術能夠\n在封裝過程中承受銲錫高溫，而且製造過程中預存的記憶體資料並不會在高溫封裝過程中\n流失。\n\n相較於28奈米嵌入式快閃記憶體，具備銲錫迴焊能力的22奈米eMRAM大幅減少所需增加的\n光罩層，其寫入資料速度與可靠度亦高度提升，相當適合應用於重視保留預存資料的產品\n，例如穿戴式及物聯網裝置。同時，亦提出若不需具備銲錫迴焊能力，有機會可更大幅降\n低eMRAM寫入資料功耗及讀取時間，而且仍能維持其非揮發性，呈現非揮發性的隨機存取\n記憶體的特性，諸多應用例如低耗電機器學習推論處理器皆能夠受惠於上述特性。\n\n論文亮點方面，3奈米及更先進製程電晶體微縮面臨的主要挑戰之一，在於電晶體電子流\n通的通道不但要更短，同時也必須更薄，以確保良好的開關閘行為，因此衍生了二維通道\n材料的研究。\n\n台積電發表的「直接使用通道區域選擇性CVD成長法在SiOx/Si基板上製造的40nm通道長度\n上閘極WS2pFET的首次展示」論文，展示了使用一種有潛力的二維材料二硫化鎢(WS2)進行\n大量生產的可能性，利用產業所熟悉的的化學氣相沉積(CVD)半導體製程直接在矽晶基板\n上製造WS2短通道電晶體。\n\n原本生產WS2薄膜的傳統製程要求將材料先沉積於藍寶石基板，移除之後再放置於矽晶圓\n之上，相較之下，通道區域選擇性CVD提供了更加簡易的量產方法。本論文有助於量產未\n來世代電晶體的研究方向。\n\n其他兩篇亮點論文則是以整體系統層次出發，藉由小晶片(Chiplet)的組合建構出系統而\n非個別電晶體的方式來解決微縮的挑戰。不同於系統單晶片(SoC)將系統的每一個元件放\n在單一裸晶上，小晶片是將不同的功能分散到可以不同的製程技術生產的個別微小裸晶，\n提供了靈活性與節省成本的優勢，且面積小的裸晶具有更好良率。為了達到與SoC相當的\n效能，小晶片必須能夠透過密集、高速、高頻寬的連結來進行彼此溝通。\n\n台積電更以「適用於高效能運算的7nm 4GHz Arm核心CoWoS小晶片設計」為題的論文，詳\n細介紹了CoWoS先進封裝解決方案中的7奈米雙小晶片系統。每個小晶片內建運作時脈4GHz\n的Arm核心以支援高效能運算應用，晶片內建跨核心網狀互連運作時脈可達4GHz。\n\n小晶片之間的連結則是透過台積電獨特的\nLow-voltage-In-Package-INterCONnect(LIPINCON)技術，資料傳輸速率達8Gb/s/pin，並\n且擁有優異的功耗效益，相較於最近其他論文所展示的類似連結解決方案的效能範圍則介\n於2Gb/s/pin至5.3Gb/s/pin。\n\n最後，「3D多晶片與系統整合晶片(SoIC)的整合」論文則是揭露了完整的三維(3D)整合技\n術，此項系統整合晶片解決方案將不同尺寸、製程技術、以及材料的已知良好裸晶直接堆\n疊在一起。相較於傳統使用微凸塊的三維IC解決方案，台積電的系統整合晶片的凸塊密度\n與速度高出數倍，同時大幅減少功耗。\n\n系統整合晶片是前段製程整合解決方案，在封裝之前連結兩個或更多的裸晶。因此，系統\n整合晶片組能夠利用整合型扇出(InFO)或CoWoS的後端先進封裝技術來進一步整合其他晶\n片，打造一個強大的「3D x 3D」系統級解決方案。\n\n此外，台積電亦對高通(Qualcomm)發表的論文「7奈米行動系統單晶片、5G平台技術及設\n計共同開發支援PPA與可製造性」做出貢獻，闡述高通驍龍SDM855行動系統單晶片及採用7\n奈米FinFET技術的全球第一個商用5G平台。\n\n\n3.心得/評論：\n相較於三星在晶圓代工論壇大會上的大動作宣揚自身技術，台積電則是對於未來技術藍圖\n布局縝密且清楚揭露，技術推進均按既定時程，並且擁有先進製程、封測等一條龍服務，\n目前具指標性且需要用上高價先進製程的蘋果、高通、超微、賽靈思與博通等，仍持續採\n用台積電7奈米與5奈米製程技術。\n\n--\n※ 發信站: 批踢踢實業坊(ptt.cc), 來自: 180.218.30.118 (臺灣)\n※ 文章網址: https://www.ptt.cc/bbs/Stock/M.1559906408.A.DCE.html\n推 EthanWake   : 跟樓下想的一樣 06/07 19:26\n→ apple123773 : 看不懂.... 06/07 19:31\n推 aihtnyc     : 總而言之就是發大財, 2330 strongbuy 06/07 19:34\n→ transfight  : 發大財！台GG要噴了嗎？ 06/07 19:37\n→ transfight  : 3D封裝是龍潭廠的嗎？ 06/07 19:38\n推 godnnn      : GG得第一 06/07 19:39\n→ transfight  : 新製程是在新竹廠試驗嗎？ 06/07 19:40\n推 kline       : intel提的技術更誘人 06/07 19:43\n→ yunf        : rambus ? 06/07 19:52\n推 hellspeak   : 揮花...非...非揮發== 06/07 19:53\n→ kuma660224  : 結論：發大財！ 06/07 19:53\n", "artBodyLink": ["http://bit.ly/2Wuur7I", "https://www.ptt.cc/bbs/Stock/M.1559906408.A.DCE.html"], "artCmt": [["推 ", "EthanWake   ", ": 跟樓下想的一樣"], ["→ ", "apple123773 ", ": 看不懂...."], ["推 ", "aihtnyc     ", ": 總而言之就是發大財, 2330 strongbuy"], ["→ ", "transfight  ", ": 發大財！台GG要噴了嗎？"], ["→ ", "transfight  ", ": 3D封裝是龍潭廠的嗎？"], ["推 ", "godnnn      ", ": GG得第一"], ["→ ", "transfight  ", ": 新製程是在新竹廠試驗嗎？"], ["推 ", "kline       ", ": intel提的技術更誘人"], ["→ ", "yunf        ", ": rambus ?"], ["推 ", "hellspeak   ", ": 揮花...非...非揮發=="], ["→ ", "kuma660224  ", ": 結論：發大財！"]]}, {"artLink": "/bbs/Stock/M.1559917976.A.FBF.html", "artAuthor": "epson5566", "artTitle": "Re: [請益] 大家有經歷過2009金融海嘯嗎??", "artDate": "1559917976", "getContent": "N", "artBody": "作者epson5566 (ep)看板Stock標題Re: [請益] 大家有經歷過2009金融海嘯嗎??時間Fri Jun  7 22:32:54 2019\n\n 金融海嘯那年 我完全經歷那段時間\n\n 並且也在市場中\n\n 那段時間我是看空的 並且也做空\n\n 但最後我還是被掃出場了\n\n 從此我才了解一些書中所說的眉眉角角\n\n 但那段經歷並沒有讓我有多充實\n\n 只讓我知道 市場中大家都是賤人 呵呵\n\n※ 引述《gadacha (卡打車)》之銘言：\n: 富貴險中求\n: 不過台股萬點久了\n: 大家好像都把萬點當做理所當然\n: 也可能隨著媒體或是什麼小資存股的議題\n: 很多新手也紛紛開始問說 可以上車了嗎\n: 年初跌到9300多點時\n: 爬文好像就一堆畢業文 要搶著睡公園\n: 那如果台股跌到5000~6000點 那真的不知道要睡哪裡了\n: 不知道版上有沒有人歷經過2009年的金融海嘯\n: 是否可以分享是怎麼撐過來的\n\n--\n※ 發信站: 批踢踢實業坊(ptt.cc), 來自: 118.166.239.252 (臺灣)\n※ 文章網址: https://www.ptt.cc/bbs/Stock/M.1559917976.A.FBF.html\n噓 raywu1123   : ??? 06/07 22:33\n推 dragonjj    : 您為啥被掃出場，可否提示一下？ 06/07 22:35\n推 g10         : 平盤不能放空 一堆限制 結果眼睜睜看股票下跌沒辦法 06/07 22:35\n→ g10         : 放空 06/07 22:35\n推 sakurano1   : 沒遇過肯定不知道大空頭下的死貓跳有多高 06/07 22:36\n→ g10         : 當時電子 金融 放空多好啊 06/07 22:36\n推 gameusa     : 經歷過2019年驚榮海笑 06/07 22:36\n噓 KurakiMaki  : 你可以空期貨啊，堅持空股票是哪招？ 06/07 22:37\n 就是空期貨才會被掃出場好嗎\n※ 編輯: epson5566 (118.166.239.252 臺灣), 06/07/2019 22:37:47\n推 AGODC       : 大跌時的死貓跳是很恐怖的，去年2/6期貨多空雙殺這 06/07 22:39\n→ AGODC       : 麼快忘記? 06/07 22:39\n→ faniour     : 反彈追繳，砍單再下殺，完美坑殺 06/07 22:39\n→ jimmyloveya : 我猜是愛追空被玩死   不意外 06/07 22:42\n 我跟你說 操作絕對比你想像中複雜 不是追空的問題\n※ 編輯: epson5566 (118.166.239.252 臺灣), 06/07/2019 22:43:46\n→ jimmyloveya : 就像飆股一路狂漲  也是能坑殺一堆做多散戶 06/07 22:43\n→ jimmyloveya : 反過來像下跌的飆股  當然也能坑死一票人 06/07 22:44\n 追空說不定還沒有流動性風險的問題 短進短出\n噓 KurakiMaki  : 你可以空大盤啊，空個股幹嘛 06/07 22:45\n※ 編輯: epson5566 (118.166.239.252 臺灣), 06/07/2019 22:46:28\n→ KurakiMaki  : 金融海嘯空大盤被掃到出場，那真的沒法做操作了 06/07 22:46\n噓 Beef        : 討什麼拍 輸錢就是你嫩活該被嗆 第一天來股板？ 06/07 22:46\n 我錯了 我不應該分享心得\n※ 編輯: epson5566 (118.166.239.252 臺灣), 06/07/2019 22:47:25\n→ jimmyloveya : 人家就說空台指期貨了吧  是操作輸了還是心態輸了哈 06/07 22:47\n噓 s11qs4      : 笑了 8成重倉壓 06/07 22:48\n 笑了 你還真的猜錯了 就算你槓桿比率極低 也會爆掉喔 只要你的部位有漏洞\n※ 編輯: epson5566 (118.166.239.252 臺灣), 06/07/2019 22:49:13\n推 sakurano1   : 就是有酸民連好好看文章都沒辦法還酸別人 06/07 22:48\n推 stlinman    : 可以再多分享一下細節嗎? 雖然回憶跌到地方一定很痛 06/07 22:50\n 簡單的說 失靈的市場 所有的策略都會發生你覺得根本不會發生的事情\n 舉例好了 你有看過深度價內異動 價外卻反向的狀況嗎\n※ 編輯: epson5566 (118.166.239.252 臺灣), 06/07/2019 22:52:46\n→ s4511981    : 2009空台指期最後被掃出場沒有重壓倉...求解 06/07 22:51\n推 ttPttPtt    : 幫補血大跌反彈都能嘎死你 06/07 22:51\n→ s4511981    : ...等等 金融海嘯不是2008嗎 06/07 22:52\n 你是在最末段波做的嗎?\n※ 編輯: epson5566 (118.166.239.252 臺灣), 06/07/2019 22:56:24\n→ u770114     : 被雙巴然後崩潰凹單掃出去嗎 06/07 22:55\n 流動性問題 例如當時期交所反應太慢 等等 太多可以說的 真的幹到爆\n推 ntp915515   : 大家都知道跌到3955 06/07 22:55\n→ ntp915515   : 但沒有人知道過程曲折難以猜測 06/07 22:55\n※ 編輯: epson5566 (118.166.239.252 臺灣), 06/07/2019 22:57:42\n→ u770114     : 股市崩盤的時候 那個浪很高 大跌必反彈 反彈也不少 06/07 22:56\n→ u770114     : 所以絕對不能凹 要跟著節奏進出 06/07 22:57\n→ jimmyloveya : 期貨就是賭場阿 你走進去賭場賭輸錢 莊家就是賤人XD 06/07 22:58\n→ u770114     : 那就是運氣差惹 06/07 22:58\n推 td875421    : 幫補 一堆亂噓 06/07 22:58\n推 stlinman    : 感謝分享! 幫推 06/07 22:59\n 太多有趣的可以聊的 大家應該沒看過 價平那檔 就是最價外那檔 價外還沒開\n 還有遠近期 太多太多有趣的現象 不過這輩子我認為應該不太會再看到了\n※ 編輯: epson5566 (118.166.239.252 臺灣), 06/07/2019 23:02:30\n推 seuil       : 感謝分享 06/07 23:03\n推 oasis66666  : 感謝分享 06/07 23:03\n 08年初 原本要幫人賣出1萬多股的台泥股票 就因為一時手軟 沒出手\n 鉅額虧損\n※ 編輯: epson5566 (118.166.239.252 臺灣), 06/07/2019 23:10:44\n推 Nitrogenital: 所以新手最佳解應該是手握現金，低點分批買進 06/07 23:16\n推 ianfunky    : 推 不在當下交易的人 無法理解困難之處 06/07 23:18\n推 u770114     : 四年前流動性問題也出現過 甚麼俄羅斯操盤集團的 06/07 23:19\n→ u770114     : 也是幹翻一堆人 後來證交所好像有改善惹 06/07 23:19\n→ u770114     : 莊家骰盅有時候會卡住 cc 06/07 23:20\n推 Jaymainal   : 這邊都高手 不會有人賠錢 那怕股市剩87點 06/07 23:24\n→ dougho      : 1萬股 不是才10張??? 06/07 23:39\n 打錯了1萬多張\n※ 編輯: epson5566 (118.166.239.252 臺灣), 06/07/2019 23:40:42\n推 odom0413    : 感謝分享 06/08 00:07\n推 Yamada      : 幫補血別跟紅買綠賣的計較 06/08 00:09\n推 fantazy00077: 幫推 感謝分享 06/08 00:10\n推 gk1329      : 空頭的空單有多難做 做過的人才知道cc 06/08 00:11\n→ gk1329      : 留倉隔天跳空大漲反彈停損 然後就崩惹 超幹 06/08 00:12\n推 u770114     : 就最好做買家 然後賭可以賣個好價錢 06/08 00:17\n推 a3836458    : 總是這樣的 加油！ 06/08 00:29\n推 tim98tim    : 同意，空單的確不好做，換股操作有時沒卷很痛苦， 06/08 00:33\n→ tim98tim    : 主力給你卷又挖洞嘎你上去 06/08 00:33\n", "artBodyLink": ["https://www.ptt.cc/bbs/Stock/M.1559917976.A.FBF.html"], "artCmt": [["噓 ", "raywu1123   ", ": ???"], ["推 ", "dragonjj    ", ": 您為啥被掃出場，可否提示一下？"], ["推 ", "g10         ", ": 平盤不能放空 一堆限制 結果眼睜睜看股票下跌沒辦法"], ["→ ", "g10         ", ": 放空"], ["推 ", "sakurano1   ", ": 沒遇過肯定不知道大空頭下的死貓跳有多高"], ["→ ", "g10         ", ": 當時電子 金融 放空多好啊"], ["推 ", "gameusa     ", ": 經歷過2019年驚榮海笑"], ["噓 ", "KurakiMaki  ", ": 你可以空期貨啊，堅持空股票是哪招？"], ["推 ", "AGODC       ", ": 大跌時的死貓跳是很恐怖的，去年2/6期貨多空雙殺這"], ["→ ", "AGODC       ", ": 麼快忘記?"], ["→ ", "faniour     ", ": 反彈追繳，砍單再下殺，完美坑殺"], ["→ ", "jimmyloveya ", ": 我猜是愛追空被玩死   不意外"], ["→ ", "jimmyloveya ", ": 就像飆股一路狂漲  也是能坑殺一堆做多散戶"], ["→ ", "jimmyloveya ", ": 反過來像下跌的飆股  當然也能坑死一票人"], ["噓 ", "KurakiMaki  ", ": 你可以空大盤啊，空個股幹嘛"], ["→ ", "KurakiMaki  ", ": 金融海嘯空大盤被掃到出場，那真的沒法做操作了"], ["噓 ", "Beef        ", ": 討什麼拍 輸錢就是你嫩活該被嗆 第一天來股板？"], ["→ ", "jimmyloveya ", ": 人家就說空台指期貨了吧  是操作輸了還是心態輸了哈"], ["噓 ", "s11qs4      ", ": 笑了 8成重倉壓"], ["推 ", "sakurano1   ", ": 就是有酸民連好好看文章都沒辦法還酸別人"], ["推 ", "stlinman    ", ": 可以再多分享一下細節嗎? 雖然回憶跌到地方一定很痛"], ["→ ", "s4511981    ", ": 2009空台指期最後被掃出場沒有重壓倉...求解"], ["推 ", "ttPttPtt    ", ": 幫補血大跌反彈都能嘎死你"], ["→ ", "s4511981    ", ": ...等等 金融海嘯不是2008嗎"], ["→ ", "u770114     ", ": 被雙巴然後崩潰凹單掃出去嗎"], ["推 ", "ntp915515   ", ": 大家都知道跌到3955"], ["→ ", "ntp915515   ", ": 但沒有人知道過程曲折難以猜測"], ["→ ", "u770114     ", ": 股市崩盤的時候 那個浪很高 大跌必反彈 反彈也不少"], ["→ ", "u770114     ", ": 所以絕對不能凹 要跟著節奏進出"], ["→ ", "jimmyloveya ", ": 期貨就是賭場阿 你走進去賭場賭輸錢 莊家就是賤人XD"], ["→ ", "u770114     ", ": 那就是運氣差惹"], ["推 ", "td875421    ", ": 幫補 一堆亂噓"], ["推 ", "stlinman    ", ": 感謝分享! 幫推"], ["推 ", "seuil       ", ": 感謝分享"], ["推 ", "oasis66666  ", ": 感謝分享"], ["推 ", "Nitrogenital", ": 所以新手最佳解應該是手握現金，低點分批買進"], ["推 ", "ianfunky    ", ": 推 不在當下交易的人 無法理解困難之處"], ["推 ", "u770114     ", ": 四年前流動性問題也出現過 甚麼俄羅斯操盤集團的"], ["→ ", "u770114     ", ": 也是幹翻一堆人 後來證交所好像有改善惹"], ["→ ", "u770114     ", ": 莊家骰盅有時候會卡住 cc"], ["推 ", "Jaymainal   ", ": 這邊都高手 不會有人賠錢 那怕股市剩87點"], ["→ ", "dougho      ", ": 1萬股 不是才10張???"], ["推 ", "odom0413    ", ": 感謝分享"], ["推 ", "Yamada      ", ": 幫補血別跟紅買綠賣的計較"], ["推 ", "fantazy00077", ": 幫推 感謝分享"], ["推 ", "gk1329      ", ": 空頭的空單有多難做 做過的人才知道cc"], ["→ ", "gk1329      ", ": 留倉隔天跳空大漲反彈停損 然後就崩惹 超幹"], ["推 ", "u770114     ", ": 就最好做買家 然後賭可以賣個好價錢"], ["推 ", "a3836458    ", ": 總是這樣的 加油！"], ["推 ", "tim98tim    ", ": 同意，空單的確不好做，換股操作有時沒卷很痛苦，"], ["→ ", "tim98tim    ", ": 主力給你卷又挖洞嘎你上去"]]}, {"artLink": "/bbs/Stock/M.1559919634.A.A4A.html", "artAuthor": "vbn22", "artTitle": "Re: [請益] 大家有經歷過2009金融海嘯嗎??", "artDate": "1559919634", "getContent": "N", "artBody": "作者vbn22 (vbn22)看板Stock標題Re: [請益] 大家有經歷過2009金融海嘯嗎??時間Fri Jun  7 23:00:32 2019\n[←]離開 [→]閱讀 [Ctrl-P]發表文章 [d]刪除 [z]精華區 [i]看板資訊/設定 [h]說明\n   編號    日 期 作  者       文  章  標  題                        人氣:2037  \n    490 m1711/13 sfp          R: [心得] 開始出現一堆雞蛋水餃股...\n    491 m5611/16 isaacchen    □ [心得] 聽我一言:請客觀看待消費券政策之必要性\n    492 m1711/16 isaacchen    R: [心得] 聽我一言:請客觀看待消費券政策之必要性\n    493 m 611/17 Ohlendorf    R: [心得] 聽我一言:請客觀看待消費券政策之必要性\n    494 m 411/19 siriue       □ [心得] 小故事(1)\n    495 m1711/19 siriue       □ [心得] 小故事(2)\n    496 m 611/20 stasis       R: [心得] 財務報表-成長公司的處罰與衰退公司的迴光\n    497 m2011/20 zerohero     □ [心得] 機哩瓜啦(上)\n    498 m1111/25 coconing     R: [請益] 營建股與鋼鐵股與水泥的關係?\n    499 m爆11/26 GPR70        R: [新聞] 抓完禿鷹 追內線！ 陳樹：手中就有10幾 …\n●  500 m4911/27 ceosa        R: [新聞] 張金鶚：北市房價至少有下降三成空間\n    501 m 411/27 stasis       R: [心得] 耶!打敗大盤與ETF的投資法出現了!\n    502 m5211/27 stasis       □ [心得] 股市包租公\n    503 m2811/29 stasis       □ [其他] 蘋果樹與經驗\n    504 m1211/29 badfood      □ [其他] 花旗 股利\n    505 m爆12/02 djviva       □ [新聞] 陳博志︰馬遲不認錯 會害慘台灣\n    506 m 212/05 TanIsVaca    □ [其他] 拓樸產業研究所和IDC的網頁\n    507 m2512/07 stasis       R: [心得] 股市包租公\n    508 m1212/08 stasis       □ [其他] 推書兩本\n    509 m 12/11 midnight9    R: [新聞] 亞幣走升 新台幣兌美元中午勁升1.23角\n\n\n以上是當時版上的氛圍\n只有以下兩位高手還存活在版上\nzerohero stasis\nbadfood 當時靠借錢 現在資產五千萬以上 財富自由了\n其他都消失了 羅啪啪還是一如往常躲在推文\ncoconing 當時是妹ㄚ 現在也結婚生子了\n連看空名人小約翰也消失了\n這就是時代的殘酷\n\n--\n※ 發信站: 批踢踢實業坊(ptt.cc), 來自: 58.114.184.91 (臺灣)\n※ 文章網址: https://www.ptt.cc/bbs/Stock/M.1559919634.A.A4A.html\n→ u770114     : 可可寧應該更早就是妹ㄚ惹 06/07 23:02\n推 huk40199    : 過幾年再掃一批出去 06/07 23:04\n噓 iuakob      : 約翰 824有帶領我們 06/07 23:07\n推 suendy      : 當時大盤月K值10.57，目前63.48 06/07 23:08\n噓 iuakob      : Catch the John Fever 06/07 23:09\n推 DaringDo    : stasis好像是一直推廣 ETF? 06/07 23:09\n→ missucrystal: 對高手不殘酷啊 很多高手可能只是賺飽離開 06/07 23:27\n推 tonyd       : 一晃眼已十年 QQ 06/07 23:35\n→ zeko        : 大長老集團也不在了 06/07 23:43\n噓 cloverfan   : 你怎摸可以忘了ppi123 06/07 23:44\n→ cloverfan   : 原來咖啡撲撲就是小約翰啊 06/07 23:44\n推 justinnn    : 可可寧記得是在某一天突然就出現,然後就一直到現在 06/08 00:11\n", "artBodyLink": ["https://www.ptt.cc/bbs/Stock/M.1559919634.A.A4A.html"], "artCmt": [["→ ", "u770114     ", ": 可可寧應該更早就是妹ㄚ惹"], ["推 ", "huk40199    ", ": 過幾年再掃一批出去"], ["噓 ", "iuakob      ", ": 約翰 824有帶領我們"], ["推 ", "suendy      ", ": 當時大盤月K值10.57，目前63.48"], ["噓 ", "iuakob      ", ": Catch the John Fever"], ["推 ", "DaringDo    ", ": stasis好像是一直推廣 ETF?"], ["→ ", "missucrystal", ": 對高手不殘酷啊 很多高手可能只是賺飽離開"], ["推 ", "tonyd       ", ": 一晃眼已十年 QQ"], ["→ ", "zeko        ", ": 大長老集團也不在了"], ["噓 ", "cloverfan   ", ": 你怎摸可以忘了ppi123"], ["→ ", "cloverfan   ", ": 原來咖啡撲撲就是小約翰啊"], ["推 ", "justinnn    ", ": 可可寧記得是在某一天突然就出現,然後就一直到現在"]]}, {"artLink": "/bbs/Stock/M.1559919656.A.444.html", "artAuthor": "n12422kimo", "artTitle": "Re: [標的] 6186 新潤興業", "artDate": "1559919656", "getContent": "N", "artBody": "作者n12422kimo (水藍色狂想)看板Stock標題Re: [標的] 6186 新潤興業時間Fri Jun  7 23:00:51 2019\n※ 引述《n12422kimo (水藍色狂想)》之銘言：\n: 1. 標的：6186 新潤\n: 2. 分類：多\n: 3. 分析/正文：\n: 關於新潤，很多人都會把新潤建設、新潤興業、華潤給搞混，以為他們是子母公司，事實不\n: 然，雖然老闆同一個人，但上櫃的只有新潤興業(6186)，其他二家無任何關系，所以在查詢\n: 建案的別混在一起查，會灌水太多。\n: 回到正題，根據108第一季財報，新潤目前總共有8筆在推行的建案，已公開發售的有4筆、\n: 分別為翠峰、A18、幸福莊園、橋峰；6月公開推出的是鉑麗；另外淡水新市段的尚未正式推\n: 出，最後二個土城案當在規劃中。\n: 以下根據預估完工時間做建案介紹。\n: 一、    新潤翠峰，位於板橋永翠段，總銷為24億，預估完工日為2019年12月，預估交屋日\n: 應該落在2020年第一季，銷售進度為90%，預估完銷eps為3.5-4.5元。\n\n這個建案，根據後來的消息指出，發言人很肯定會在今年年底認列。\n由於這個原因，會導致2020的eps沒那麼高了，所以下修目標價26。\n\n\n--\n※ 發信站: 批踢踢實業坊(ptt.cc), 來自: 125.230.166.131 (臺灣)\n※ 文章網址: https://www.ptt.cc/bbs/Stock/M.1559919656.A.444.html\n推 qaz22608071 : 推 持續追蹤 希望中短期內22能守住 06/07 23:05\n推 iloveloveptt: 26太高 06/07 23:11\n", "artBodyLink": ["https://www.ptt.cc/bbs/Stock/M.1559919656.A.444.html"], "artCmt": [["推 ", "qaz22608071 ", ": 推 持續追蹤 希望中短期內22能守住"], ["推 ", "iloveloveptt", ": 26太高"]]}, {"artLink": "/bbs/Stock/M.1559919845.A.4B2.html", "artAuthor": "CLV518", "artTitle": "[新聞] 美禁令發酵 臉書禁止華為手機預裝其App", "artDate": "1559919845", "getContent": "N", "artBody": "作者CLV518 (ANON)看板Stock標題[新聞] 美禁令發酵 臉書禁止華為手機預裝其App時間Fri Jun  7 23:04:02 2019\n1.原文連結：\nhttps://www.epochtimes.com/b5/19/6/7/n11307257.htm\n\n2.原文內容：\n\n（大紀元記者張婷綜合報導）\n\n路透社週五（6月7日）獨家報道稱，臉書不再允許在華為智能手機上預裝其應用程式。這是自美國商務部5月份將華為列入出口管制黑名單後，華為遭受的又一重大打擊。\n\n臉書告訴路透社，已擁有華為手機的客戶，仍可使用這些應用式序並接收更新。但新的華為手機將不再允許預裝臉書及其所擁有的WhatsApp和Instagram等應用程式。\n\n《華爾街日報》報導，在一份聲明中，臉書的一位發言人稱，公司方面正在查看商務部的最終規定和最近發布的臨時通用許可證，並採取措施確保臉書遵守美國規定。\n\n智能手機供應商通常會獲得商業協議，允許在手機中預裝一些最受消費者歡迎的應用程式，如臉書等。推特和Booking.com在很多市場上也被預裝在華為手機上。路透社說，推特謝絕對此發表評論。「Booking Holdings」未就置評請求給予回應。華為也拒絕發表評論。\n\n臉書的這一舉措將進一步削弱華為智能手機的銷售前景。去年，受到歐洲和亞洲市場的強勁推動，華為的智能手機是其最大的收入來源。\n\n\n被列入黑名單後 華為持續受挫\n\n5月中旬，美國商務部正式將華為及其在20多個國家的68家附屬公司列入出口管制黑名單。未來華為在進口美國零部件和服務前，必須先取得「工業和安全局」（BIS）的批准，也就是說，在BIS許可前，美國公司不能銷售或轉移技術或產品給華為公司。這相當於有效禁止美國公司向華為及其子公司提供組件和技術。\n\n這促使美光、高通、英特爾等多家科技公司，陸續宣布遵守美國命令停止對華為出貨。\n\n華為在美國以外的供應商也會受到影響，因為美國規定外國產品使用美國的零組件或軟體含量超過25%門檻時，也要遵守美國華為禁令。英國主要芯片設計公司ARM已經宣布終止與華為的業務往來，因為該公司的設計含有「源自美國的技術」。\n\n由於ARM實質上掌握最上游的芯片設計技術，分析師稱這對華為是「無法克服的打擊」。這恐將從上游切斷華為芯片開發的命脈。\n\n在臉書對華為的禁令傳出之前，谷歌已經宣布停止授權給華為使用安卓（Android）系統，並跟隨美國商務部的指令緩刑90天。\n\n研究公司IDC分析師布萊恩·馬（Bryan Ma）表示，對於大陸以外的幾百萬用戶而言，無法使用谷歌應用程式和服務，「華為手機就失去了吸引力」。\n\n「它扼殺了華為手機在中國以外的使用價值，華為將溺水而死。」他補充說。\n\n知情人士告訴路透社，臉書的禁令適用於任何尚未離開工廠的華為手機。臉書拒絕就這一措施生效的時間發表評論。\n\n現有的華為手機型號如果沒有臉書預裝，買家仍然可以從「Google Playstore」下載。但未來版本的華為手機，無法訪問「Google Playstore」及其應用，除非美國政府改變現有政策。\n\n近期以來，許多國家都出現拋售華為手機，致其價格下跌的現象。歐洲和亞洲商店的一些客戶告訴路透社，他們不願意在當前充滿不確定因素的情況下購買華為手機，分析師預計華為智能手機銷量將大幅下滑。\n\n雖然華為創始人任正非對外宣稱，美國的出口管制對華為的影響有限，但知情人士告訴《日經亞洲評論》，華為目前已經減少或取消了其智能手機和電信設備組件的主要供應商的訂單。全球最大的合約芯片製造商台積電（Taiwan Semiconductor Manufacturing Co.）週三（6月5日）證實，華為的訂單已經下降。\n\n一名熟知華為智能手機訂單的消息人士告訴《日經》，在上了美國的黑名單後，華為已將其對2019年下半年智能手機總出貨量的預測下調了「大約20%至30%」。\n\n\n3.心得/評論：\n\n這措施對現有手機是沒差，沒預載還是能用商店裝，\n但之後的新款手機連google play都不能用的就有差了；\n在美國禁令下Facebook想繼續舔共賺錢也是偏難。\n\n但仔細想想其實廣告收入應該影響也不大，\n畢竟即使歐洲現在華為有一定市占、變成鴻蒙OS後人大概也跑光；\n之後換別的手機Facebook依舊能夠吃到廣告收入。\n\n--\n    川普一連五次轉發英文大紀元文章\n     https://tinyurl.com/y3yz82hw\n\n「川普總統天天看大紀元」 真實報導獲讚賞\n      http://tinyurl.com/y9tpd2r2\n\n--\n※ 發信站: 批踢踢實業坊(ptt.cc), 來自: 185.220.102.8 (德國)\n※ 文章網址: https://www.ptt.cc/bbs/Stock/M.1559919845.A.4B2.html\n推 jason885200 : 川普去吃屎 06/07 23:06\n→ wtl         : FB中國都不讓他進來 也沒什麼好怕的 06/07 23:12\n推 pisu        : 共匪趕快倒一倒啦 06/07 23:19\n推 kline       : 五毛：我們有強大的俄羅斯和一堆第三世界國家盟友， 06/07 23:22\n→ kline       : 我們有自己強大的技術強大的系統我們不怕 06/07 23:22\n推 hedgehogs   : 大紀元不可信 06/07 23:24\n推 obrag       : 不能預裝 之後自己下載就好啊 06/07 23:26\n推 aqua232     : 大陸又不能用fab,反而是幫了大陸政策吧 06/07 23:32\n噓 joe00477    : 沒差，有微博抖音 06/07 23:35\n→ frank01     : 歐洲不知, 台灣本來就沒有預裝了 ,而且有差嗎,自己 06/07 23:54\n→ frank01     : 裝就好！ 06/07 23:54\n→ spath       : 其實我比較討厭那些預裝的東西，很多都砍不掉 06/08 00:13\n推 ndd2        : 本來就自己裝 06/08 00:20\n", "artBodyLink": ["https://www.epochtimes.com/b5/19/6/7/n11307257.htm", "https://tinyurl.com/y3yz82hw", "http://tinyurl.com/y9tpd2r2", "https://www.ptt.cc/bbs/Stock/M.1559919845.A.4B2.html"], "artCmt": [["推 ", "jason885200 ", ": 川普去吃屎"], ["→ ", "wtl         ", ": FB中國都不讓他進來 也沒什麼好怕的"], ["推 ", "pisu        ", ": 共匪趕快倒一倒啦"], ["推 ", "kline       ", ": 五毛：我們有強大的俄羅斯和一堆第三世界國家盟友，"], ["→ ", "kline       ", ": 我們有自己強大的技術強大的系統我們不怕"], ["推 ", "hedgehogs   ", ": 大紀元不可信"], ["推 ", "obrag       ", ": 不能預裝 之後自己下載就好啊"], ["推 ", "aqua232     ", ": 大陸又不能用fab,反而是幫了大陸政策吧"], ["噓 ", "joe00477    ", ": 沒差，有微博抖音"], ["→ ", "frank01     ", ": 歐洲不知, 台灣本來就沒有預裝了 ,而且有差嗎,自己"], ["→ ", "frank01     ", ": 裝就好！"], ["→ ", "spath       ", ": 其實我比較討厭那些預裝的東西，很多都砍不掉"], ["推 ", "ndd2        ", ": 本來就自己裝"]]}, {"artLink": "/bbs/Stock/M.1559921257.A.A33.html", "artAuthor": "kaiming7955", "artTitle": "[新聞] 貿易戰打不停 外資5月淨匯出640億元 一", "artDate": "1559921257", "getContent": "N"}, {"artLink": "/bbs/Stock/M.1559921929.A.E76.html", "artAuthor": "YAYA6655", "artTitle": "Re: [請益] 大家有經歷過2009金融海嘯嗎??", "artDate": "1559921929", "getContent": "N", "artBody": "作者YAYA6655 (YAYA)看板Stock標題Re: [請益] 大家有經歷過2009金融海嘯嗎??時間Fri Jun  7 23:38:47 2019\n2008金融海嘯的時候，我在9000點做多拉到9400出脫\n\n然後就沒碰了好好運喔\n\n可是再上一次的金融海嘯，我從10000->8000就快虧到認不出爹娘了\n\n還好媽咪叫我要停損。不然我應該從此就離開市場了吧，好坑人阿。\n\n市場好無情阿。那個價格都跌很多了還天天跌，真的是不可理喻阿。\n\n\n--\n※ 發信站: 批踢踢實業坊(ptt.cc), 來自: 111.83.94.34 (臺灣)\n※ 文章網址: https://www.ptt.cc/bbs/Stock/M.1559921929.A.E76.html\n→ ruln        : 開始廢文了嗎? 06/07 23:49\n噓 kichikuou   : 咦咦喔喔不知道說啥 06/08 00:13\n→ qaz12453    : 還好最後還是認出你娘 06/08 00:25\n", "artBodyLink": ["https://www.ptt.cc/bbs/Stock/M.1559921929.A.E76.html"], "artCmt": [["→ ", "ruln        ", ": 開始廢文了嗎?"], ["噓 ", "kichikuou   ", ": 咦咦喔喔不知道說啥"], ["→ ", "qaz12453    ", ": 還好最後還是認出你娘"]]}, {"artLink": "/bbs/Stock/M.1559922427.A.977.html", "artAuthor": "rockok71", "artTitle": "Re: [請益] 大家有經歷過2009金融海嘯嗎??", "artDate": "1559922427", "getContent": "N", "artBody": "作者rockok71 (鈞鈞有意思)看板Stock標題Re: [請益] 大家有經歷過2009金融海嘯嗎??時間Fri Jun  7 23:47:04 2019\n\n\n強者我親戚\n\n股市正好時  本來開TOYOTA最低款那種\n\n路過他家  無意間看到他換新款BMW\n\n\n\n再過幾年\n\n發現外婆留給他的房子賣掉了\n\nBMW也不見了  也換工作了\n\n\n\n現在人也不知道在幹嘛  因為沒再連繫了\n\n只知道外婆外公的祖產  BANG不見了\n\n\n\n\n\n\n\n※ 引述《gadacha (卡打車)》之銘言：\n: 富貴險中求\n: 不過台股萬點久了\n: 大家好像都把萬點當做理所當然\n: 也可能隨著媒體或是什麼小資存股的議題\n: 很多新手也紛紛開始問說 可以上車了嗎\n: 年初跌到9300多點時\n: 爬文好像就一堆畢業文 要搶著睡公園\n: 那如果台股跌到5000~6000點 那真的不知道要睡哪裡了\n: 不知道版上有沒有人歷經過2009年的金融海嘯\n: 是否可以分享是怎麼撐過來的\n\n--\n\n 地方的魯蛇需要_____?\n                      請眾動物回答。\n\n--\n※ 發信站: 批踢踢實業坊(ptt.cc), 來自: 114.32.240.175 (臺灣)\n※ 文章網址: https://www.ptt.cc/bbs/Stock/M.1559922427.A.977.html\n推 GalacticEcho: 十年的大多頭，已經讓大家把金融海嘯當作古老而虛 06/07 23:51\n→ GalacticEcho: 幻的神話故事了。 06/07 23:51\n推 u770114     : 那個天時地利人和大概要再等幾十年了 06/07 23:52\n推 lalamio     : 有啊 六塊玉山金撿起來！ 06/07 23:59\n推 waterydan   : 會嗎?我覺得大家都很期待金融海嘯來  才能歐硬反轉 06/08 00:01\n→ waterydan   : 翻轉人生  不燃這輩子領這死薪水連台北廁所都買不起 06/08 00:01\n→ waterydan   : 快殺到3000點  我就把錢歐硬股市 06/08 00:02\n→ kichikuou   : 你還有錢想幹一筆的時候不會金融海嘯啦 06/08 00:14\n→ spath       : 要玩到祖產都沒了，槓桿是開多大… 06/08 00:20\n→ qaz12453    : 蠻猛的押身家祖產 06/08 00:24\n推 chriter     : 死薪水等歐印時機+1  多恨2008時還只是學生沒錢 06/08 00:26\n", "artBodyLink": ["https://www.ptt.cc/bbs/Stock/M.1559922427.A.977.html"], "artCmt": [["推 ", "GalacticEcho", ": 十年的大多頭，已經讓大家把金融海嘯當作古老而虛"], ["→ ", "GalacticEcho", ": 幻的神話故事了。"], ["推 ", "u770114     ", ": 那個天時地利人和大概要再等幾十年了"], ["推 ", "lalamio     ", ": 有啊 六塊玉山金撿起來！"], ["推 ", "waterydan   ", ": 會嗎?我覺得大家都很期待金融海嘯來  才能歐硬反轉"], ["→ ", "waterydan   ", ": 翻轉人生  不燃這輩子領這死薪水連台北廁所都買不起"], ["→ ", "waterydan   ", ": 快殺到3000點  我就把錢歐硬股市"], ["→ ", "kichikuou   ", ": 你還有錢想幹一筆的時候不會金融海嘯啦"], ["→ ", "spath       ", ": 要玩到祖產都沒了，槓桿是開多大…"], ["→ ", "qaz12453    ", ": 蠻猛的押身家祖產"], ["推 ", "chriter     ", ": 死薪水等歐印時機+1  多恨2008時還只是學生沒錢"]]}, {"artLink": "/bbs/Stock/M.1559924396.A.CD9.html", "artAuthor": "huk40199", "artTitle": "Re: [請益] 大家有經歷過2009金融海嘯嗎??", "artDate": "1559924396", "getContent": "N", "artBody": "作者huk40199 (goodluck)看板Stock標題Re: [請益] 大家有經歷過2009金融海嘯嗎??時間Sat Jun  8 00:19:54 2019\n正常來看當大家都想抄底的時候不會崩\n\n尤其你去看中產階級家庭買房\n\n一般路線就是大部分人會買在高點\n\n結果過一兩年大崩盤\n\n工作丟了貸款繳不出來持續快一年\n\n這時候更不用說抄底\n\n所以結論就是要崩\n\n再等幾年\n\n--\n※ 發信站: 批踢踢實業坊(ptt.cc), 來自: 114.137.179.117 (臺灣)\n※ 文章網址: https://www.ptt.cc/bbs/Stock/M.1559924396.A.CD9.html\n", "artBodyLink": ["https://www.ptt.cc/bbs/Stock/M.1559924396.A.CD9.html"], "artCmt": []}]}