{"items": [{"artLink": "/bbs/Stock/M.1559987692.A.36F.html", "artAuthor": "foxconn1080", "artTitle": "[標的] 台灣美股適合對沖&避險的工具?", "artDate": "1559987692", "getContent": "N", "artBody": "作者foxconn1080 (鴻)看板Stock標題[標的] 台灣美股適合對沖的工具?時間Sat Jun  8 17:54:50 2019\n如果想對美股現貨進行 避險 或是 對沖\n\n\n請問股版高手們\n\n建議用富邦VIX or 國泰美國道瓊反1 00669R\n\n來做工具會比較好?\n\n小弟的想法是富邦VIX是槓桿的效果，波動劇烈，可以小資金部位避險?\n(但現貨 vs VIX部位的比例還不是很確定)\n\n如果是要做1:1部位的避險應該是採用\n\n國泰美國道瓊反1 00669R\n\n不知道版上高手們的看法是?\n\n\n感謝\n\n--\n※ 發信站: 批踢踢實業坊(ptt.cc), 來自: 101.13.209.121 (臺灣)\n※ 文章網址: https://www.ptt.cc/bbs/Stock/M.1559987692.A.36F.html\n※ 編輯: foxconn1080 (101.13.209.121 臺灣), 06/08/2019 18:17:56\n→ lajji       : 小資金避險請愛用期權 06/08 18:24\n→ kolinru     : 小資金避什麼險 賣掉就好了 06/08 18:33\n噓 darkMood    : 幾千萬美金喔？ 06/08 18:57\n推 qr1348      : 空小道很難嗎 06/08 18:58\n推 sole772pk37 : 跟主力做對就贏一半 06/08 19:18\n推 Prano       : 也可能輸一半 06/08 19:25\n→ kusomanfcu  : 你知道兩邊都做會賠嗎？ 06/08 19:33\n→ kusomanfcu  : 只是會少賠 06/08 19:34\n推 lynchen     : 小資金設停損 06/08 19:35\n噓 yoyohu      : 小資金不用想什麼避險 直接平倉就好了 06/08 19:47\n→ yoyohu      : 對沖 直接下期貨最快 不用去做什麼ETF拐彎抹角的 06/08 19:48\n推 jay0117     : 我記得股版 千萬以下臺幣交易都叫散戶 超過千萬在 06/08 20:07\n→ jay0117     : 來想這問題好嗎？ 06/08 20:07\n→ jay0117     : 奈米戶賣一賣就叫避險了 06/08 20:08\n推 kikidmore   : TVIX 06/08 20:56\n推 aegis43210  : 避險買美債就好了 06/08 21:03\n噓 mirac1e     : 資金沒五百萬的 沒必要避險 06/08 21:15\n", "artBodyLink": ["https://www.ptt.cc/bbs/Stock/M.1559987692.A.36F.html"], "artCmt": [["→ ", "lajji       ", ": 小資金避險請愛用期權"], ["→ ", "kolinru     ", ": 小資金避什麼險 賣掉就好了"], ["噓 ", "darkMood    ", ": 幾千萬美金喔？"], ["推 ", "qr1348      ", ": 空小道很難嗎"], ["推 ", "sole772pk37 ", ": 跟主力做對就贏一半"], ["推 ", "Prano       ", ": 也可能輸一半"], ["→ ", "kusomanfcu  ", ": 你知道兩邊都做會賠嗎？"], ["→ ", "kusomanfcu  ", ": 只是會少賠"], ["推 ", "lynchen     ", ": 小資金設停損"], ["噓 ", "yoyohu      ", ": 小資金不用想什麼避險 直接平倉就好了"], ["→ ", "yoyohu      ", ": 對沖 直接下期貨最快 不用去做什麼ETF拐彎抹角的"], ["推 ", "jay0117     ", ": 我記得股版 千萬以下臺幣交易都叫散戶 超過千萬在"], ["→ ", "jay0117     ", ": 來想這問題好嗎？"], ["→ ", "jay0117     ", ": 奈米戶賣一賣就叫避險了"], ["推 ", "kikidmore   ", ": TVIX"], ["推 ", "aegis43210  ", ": 避險買美債就好了"], ["噓 ", "mirac1e     ", ": 資金沒五百萬的 沒必要避險"]]}, {"artLink": "/bbs/Stock/M.1559994891.A.07E.html", "artAuthor": "j2708180", "artTitle": "[新聞] 移民署採購弊案 神通少東苗華斌等6人訊", "artDate": "1559994891", "getContent": "N", "artBody": "作者j2708180 (JaJa)看板Stock標題[新聞] 移民署採購弊案 神通少東苗華斌等6人訊時間Sat Jun  8 19:54:49 2019\n1.原文連結：\n\nhttps://news.ltn.com.tw/news/society/breakingnews/2813825\n\n2.原文內容：\n\n移民署採購弊案 神通少東苗華斌等6人訊後請回\n\n曾任移民署資訊組長的公務員施明德，涉嫌在標案上圖利特定廠商，今年4月遭依貪污、\n洗錢罪羈押禁見。檢廉追查發現，涉弊的標案中，得標廠商包括大同（2371）、聯華神通\n集團的神通資科，昨兵分2路搜索2間公司，約談神通集團少東苗華斌等6人到案說明，漏\n夜偵訊後全部無保請回。\n\n本次搜索約談南員除了苗華斌，還包括神通業務處長曾德修、大同公司標案前承辦人郭俊\n豐、大同顧問郭正義及經手標案的相關人等。\n\n檢廉調查，施明德於2009年至2016年間，利用主導移民署多起標案的機會，涉嫌圖利特定\n廠商，並收回扣，目前已知7件涉弊，包括金額逾7億7千萬元的「陸客來台線上申請平台\n及入出國查驗系統」，以及5200萬元的「入出國查驗暨自動通關系統委外建置案」。\n\n據政府開放標案得標廠商資料，自2015年起至今，大同公司得標的移民署案件，共有24件\n，總金額逾40億元，聯華神通得標的則有9件，總金額約3.1億元，過去曾搜索過的凌網科\n技則有17件，總金額超過4.2億元，是移民署得標金額前三高的廠商。\n\n3.心得/評論：\n\n扯上大同…\n\n99聯華集團的子公司\n\n套牢套慘了\n\n--\n※ 發信站: 批踢踢實業坊(ptt.cc), 來自: 1.174.4.122 (臺灣)\n※ 文章網址: https://www.ptt.cc/bbs/Stock/M.1559994891.A.07E.html\n→ nawussica   : 99施明德 06/08 19:56\n推 CSLsong     : 聯華麵粉王氣體王，不怕不怕～ 06/08 19:57\n→ tctv2002    : 抄底好機費 06/08 19:59\n→ nptrj       : 聯華跟聯華食有什差別都搞不太懂 06/08 20:06\n還有個2303聯華電子\n※ 編輯: j2708180 (1.174.4.122 臺灣), 06/08/2019 20:07:52\n推 cindycincia : 無保請回 06/08 20:10\n推 kutkin      : 不就都苗家的嗎 06/08 20:11\n推 kusomanfcu  : 聯華系列全空手的意思？ 06/08 20:15\n推 AGODC       : 難怪聯華食走勢怪怪的，還好之前出了 06/08 20:36\n推 kusomanfcu  : 你們都忘了聯詠就是了 06/08 20:53\n→ kusomanfcu  : 板上一堆人買XD 06/08 20:53\n推 Sana        : 還好聯華電子出了！ 06/08 21:00\n→ CATTOS25    : 神通噴噴！咦，下市了 06/08 21:01\n", "artBodyLink": ["https://news.ltn.com.tw/news/society/breakingnews/2813825", "https://www.ptt.cc/bbs/Stock/M.1559994891.A.07E.html"], "artCmt": [["→ ", "nawussica   ", ": 99施明德"], ["推 ", "CSLsong     ", ": 聯華麵粉王氣體王，不怕不怕～"], ["→ ", "tctv2002    ", ": 抄底好機費"], ["→ ", "nptrj       ", ": 聯華跟聯華食有什差別都搞不太懂"], ["推 ", "cindycincia ", ": 無保請回"], ["推 ", "kutkin      ", ": 不就都苗家的嗎"], ["推 ", "kusomanfcu  ", ": 聯華系列全空手的意思？"], ["推 ", "AGODC       ", ": 難怪聯華食走勢怪怪的，還好之前出了"], ["推 ", "kusomanfcu  ", ": 你們都忘了聯詠就是了"], ["→ ", "kusomanfcu  ", ": 板上一堆人買XD"], ["推 ", "Sana        ", ": 還好聯華電子出了！"], ["→ ", "CATTOS25    ", ": 神通噴噴！咦，下市了"]]}, {"artLink": "/bbs/Stock/M.1559997316.A.799.html", "artAuthor": "b777300", "artTitle": "Re: [新聞] 易綱暗示人民幣匯率無紅線 人民幣大跌400", "artDate": "1559997316", "getContent": "N", "artBody": "作者b777300 (su35s)看板Stock標題Re: [新聞] 易綱暗示人民幣匯率無紅線 人民幣大跌400時間Sat Jun  8 20:35:15 2019\n※ 引述《May555R (may)》之銘言：\n: 1.原文連結：\n: http://www.epochtimes.com/b5/19/6/8/n11308426.htm\n: 2.原文內容：\n: 【大紀元2019年06月08日訊】（大紀元記者劉毅報導）6月7日，人民幣兌美元離岸價盤中\n: 大跌400點，一度跌破6.96關口。而中共央行行長易綱則表示，人民幣兌美元匯率沒有紅\n: 線，「不認為某數字更重要」。\n: 6月7日，易綱在北京接受《彭博》專訪談到人民幣匯率時表示，貿易戰可能會給人民幣滙\n: 率帶來暫時性的貶值壓力。\n: 對於近來市場關心的人民幣兌美元是否會跌破7人民幣兌換1美元以及人民幣滙率是否有紅\n: 綫的問題時，易綱說：「我不認為這是一個重要的問題，不認為某個具體數字會比另一個\n: 更加重要。」\n: 易綱的這番表態和之前中共央行前行長周小川對於人民幣匯率是否會破7的說法相似。\n: 周小川5月27日在參加由博鰲亞洲論壇研究院、日本智庫亞太倡議（Asia Pacific\n: Initiative）理事會與財新傳媒聯合舉辦的圓桌會議時表示：「總體而言，如果把它（7\n: ）當作底線，這可能有點反應過度了。」有業界人士認為，周小川的言論向市場釋放了人\n: 民幣有可能破7的信號。\n: 而易綱除了上述有關人民幣滙率紅綫的表述外，還表示中共央行已經很長時間沒有干預滙\n: 市，並希望維持不干預的狀況。\n: 受易綱言論影響，離岸人民幣兌美元7日最多曾大跌近400點，一度跌破6.96關口，跌幅至\n: 少為5月31日以來最大。\n: 北京時間7日10點40左右，離岸人民幣兌美元匯率顯著走低，隨後跌幅擴大，連續跌破\n: 6.94、6.95關口。至16點左右，離岸人民幣跌幅進一步加大，一度跌破6.96關口，觸及\n: 6.9624，一天連破3大關口，創2018年11月以來新低。\n: 8日4點59分，離岸人民幣兌美元報6.9435元，較週四紐約尾盤下跌166點，盤中整體交投\n: 於6.9234～6.9608元區間，日內震幅374點。早7點25分，香港人民幣離岸價格為6.9430人\n: 民幣兌換1美元。\n: 有大陸網民透露，中共外匯管理局本來應在16點公布外匯儲備數據，結果沒有公布，人民\n: 幣離岸價瞬間跌破6.96關口，看來數據很慘，外管局不敢公布，利用假期淡化市場做空衝\n: 動。\n: 海外評論人士文小剛對此表示，美中貿易戰升級本來就令市場看衰人民幣，易綱7日的表\n: 態也被視為釋放了人民幣可能破7的信號，尤其是中共央行不干涉的言論，更是給人以中\n: 共會默許人民幣貶值的表態。而在此之前，一旦人民幣貶值接近7的時候，都是央行利用\n: 中資大行出售美元，拉抬人民幣匯率，如果真的以後央行不再干預，人民幣破7真的就不\n: 遠了。而且，中國有一部分金融界人士在貿易戰一開始就主張利用人民幣貶值來對沖美國\n: 加徵關稅造成的損失。\n: 國際投行近來也紛紛表示，如果美中貿易戰全面升級，中共會允許人民幣破7。\n: 全球領先的主動型投資管理公司安聯投資的亞太區股票首席投資總監陳致強日前表示，一\n: 旦貿易戰全面爆發，中共將允許人民幣兌美元跌破7人民幣兌換1美元。\n: 德意志銀行在5月中旬的報告中表示，美中貿易戰目前來看會持續很久，中共當局可能會\n: 更樂於見到人民幣兌美元跌至7人民幣兌換1美元。美國對總值2,000億美元中國貨加徵關\n: 稅至25%，人民幣兌美元匯率將貶至7.1，若美國對餘下3,000億美元中國貨加徵關稅，則\n: 人民幣兌美元匯率將貶值至7.4。\n: 對於人民幣跌破7，文小剛認為，7是一個市場關鍵的心理價位，人民幣一旦破7，大陸吸\n: 引國際資金的難度會加大，資金會加速流出中國，令中國陷入金融危機；另外，業界一般\n: 認為，中共的外匯儲備中有將近1萬億美元是外資帶來的，如果這些外資撤出大陸，他們\n: 也將帶走這些資金，大陸的外匯儲備將減少近三分之一。這對深受貿易戰打擊的中國經濟\n: 來說是雪上加霜。所以，中共未必會像嘴上說的那樣真敢讓人民幣破7。\n: 責任編輯：李穹\n: 3.心得/評論：\n: 看來人民幣是有可能會大幅貶值的,現在投資人真的要小心接下來的股匯市變動\n: 川普招招都在要中共的命,中共不肯就範就會出現動盪\n: 建議在中共解體前都不要再進出股市會比較好\n\n世界工廠的人民幣貶值一定會迫使全世界跟進。\n\n如果只有人民幣貶值，美國還可以使用某些經濟手段來平抑，但當全世界都跟進時，對於\n世界主流貨幣的美元來說很不利(等於全世界打美國一個，除非美國有足夠的黃金儲備可\n以扛)。\n\n美元扛不住也開始貶值時，將會瞬間造成資金大逃殺。\n\n--\n※ 發信站: 批踢踢實業坊(ptt.cc), 來自: 42.73.201.174 (臺灣)\n※ 文章網址: https://www.ptt.cc/bbs/Stock/M.1559997316.A.799.html\n噓 cpz         : Zzz 06/08 20:37\n→ b777300     : 典型的以戰逼和 06/08 20:40\n推 DaringDo    : 美國印鈔就好 06/08 20:40\n噓 jaing       : 沒考慮到產業已外移的影響？ 06/08 20:41\n→ jaing       : 原po 想法近似郭台銘，不過郭略勝一個月 06/08 20:44\n→ aloness     : 美元不是金本位，他沒差 06/08 20:53\n→ triff       : 人民幣跌成20:1美金我也不意外 06/08 20:58\n推 stlinman    : 如果美金跟著跌是已經\"通膨失控\"吧! 大家搶買金條? 06/08 21:05\n推 triff       : 美元是信用本位。 06/08 21:05\n推 huanyu2sp   : 全世界打美國一個...嘖嘖嘖 樹倒猢猻散... 06/08 21:09\n推 losage      : 請教一下，美元貶值不就其他貨幣升值嗎？ 06/08 21:17\n→ losage      : 什麼情況會大家貶，美元也貶？ 06/08 21:17\n→ Leo4891     : 大家貶　美元貶　資金大逃殺？是要殺到哪 換黃金? 06/08 21:18\n→ tsukimiyu   : 我也很好奇逃到哪？買黃金？用哪國貨幣買？ 06/08 21:22\n", "artBodyLink": ["http://www.epochtimes.com/b5/19/6/8/n11308426.htm", "https://www.ptt.cc/bbs/Stock/M.1559997316.A.799.html"], "artCmt": [["噓 ", "cpz         ", ": Zzz"], ["→ ", "b777300     ", ": 典型的以戰逼和"], ["推 ", "DaringDo    ", ": 美國印鈔就好"], ["噓 ", "jaing       ", ": 沒考慮到產業已外移的影響？"], ["→ ", "jaing       ", ": 原po 想法近似郭台銘，不過郭略勝一個月"], ["→ ", "aloness     ", ": 美元不是金本位，他沒差"], ["→ ", "triff       ", ": 人民幣跌成20:1美金我也不意外"], ["推 ", "stlinman    ", ": 如果美金跟著跌是已經\"通膨失控\"吧! 大家搶買金條?"], ["推 ", "triff       ", ": 美元是信用本位。"], ["推 ", "huanyu2sp   ", ": 全世界打美國一個...嘖嘖嘖 樹倒猢猻散..."], ["推 ", "losage      ", ": 請教一下，美元貶值不就其他貨幣升值嗎？"], ["→ ", "losage      ", ": 什麼情況會大家貶，美元也貶？"], ["→ ", "Leo4891     ", ": 大家貶　美元貶　資金大逃殺？是要殺到哪 換黃金?"], ["→ ", "tsukimiyu   ", ": 我也很好奇逃到哪？買黃金？用哪國貨幣買？"]]}]}